title,date
Wall Street Waits for Big Earnings Results,16-Oct-23
Empire State Less Bad than Expected; SCHW Mixed in Q3,16-Oct-23
Wedbush Reiterates Tesla (TSLA) Outperform Recommendation,16-Oct-23
"US STOCKS-Wall St rises with focus on earnings, economic data",16-Oct-23
What Individual Investors Should Keep in Mind This Earnings Season,16-Oct-23
See Which Of The Latest 13F Filers Holds Tesla,16-Oct-23
"What Analog Devices, Tesla, and Nvidia Stock Investors Should Know About Recent Semiconductor Updates",16-Oct-23
Here's What to Expect From Tesla (TSLA) This Earnings Season,16-Oct-23
Zacks Investment Ideas feature highlights: JPMorgan Chase and Tesla,16-Oct-23
"Pre-Market Most Active for Oct 16, 2023 :  SQQQ, TQQQ, PFE, TSLA, QQQ, PCTI, TSLL, PLTR, UBER, CL, MANU, KVUE",16-Oct-23
"US STOCKS-Wall St futures rise ahead of earnings, data; Israel-Hamas conflict weighs",16-Oct-23
Option Volatility And Earnings Report For October 16 - 20,16-Oct-23
Stocks Set to Open Higher as Investors Await Powell Speech and Corporate Earnings,16-Oct-23
Stocks Set to Open Mixed as Investors Await Powell Speech and Corporate Earnings,16-Oct-23
Is the VinFast Auto Car Wreck a Buying Opportunity?,16-Oct-23
"PREVIEW-Tesla earnings: investors watching margins, deliveries, self-driving",16-Oct-23
"US STOCKS-Futures up ahead of earnings and data, Middle East tensions weigh",16-Oct-23
Bull’s Take: Why Smart Investors Are Snapping Up TSLA Stock Now,16-Oct-23
GRAPHIC-Take Five: War and peace of mind,16-Oct-23
Ferrari to accept crypto as payment for its cars in the US,16-Oct-23
"Geopolitics, Earnings and Other Key Themes to Watch this Week",15-Oct-23
Better AI Stock: Tesla vs. Alphabet,15-Oct-23
Guru Fundamental Report for TSLA,15-Oct-23
The ‘Millionaire Playbook’ for Easy Profits in the AI Boom,15-Oct-23
"Weekly Preview: Earnings to Watch This Week 10-15-23 (NFLX, TSLA)",15-Oct-23
Here's the Best Stock-Split Stock to Buy Right Now,15-Oct-23
"Sorry, Cathie Wood. This, Not Tesla, Is the Stock to Own for the $9 Trillion Robotaxi Market.",14-Oct-23
Tesla's Price Cuts: What You Really Need to Know,14-Oct-23
Ferrari to accept crypto as payment for its cars in the US,14-Oct-23
Tesla fights $230 mln fee sought by attorneys who sued over board pay,13-Oct-23
The Impact of Climate Change on the Global Economy,13-Oct-23
3 Quarterly Reports to Watch Next Week,13-Oct-23
"Wall St Week Ahead-Investors zero in on health of consumer with retail sales, earnings",13-Oct-23
"US STOCKS-S&P 500, Nasdaq down as decline in megacaps dulls big banks' shine",13-Oct-23
"US judge says Tesla privacy case belongs in arbitration, not court",13-Oct-23
Room To Run: Why This Bull Market May Be Just Getting Started,13-Oct-23
Looking for the Next Tesla? Here Are the Top 2 EV Stock Contenders,13-Oct-23
Sociedad Quimica y Minera de Chile Well Positioned Lithium Stock,13-Oct-23
US STOCKS-Wall St set for mixed open as investors assess big bank earnings,13-Oct-23
Stop! Why Now Is the Worst Time to Buy an EV,13-Oct-23
Validea Detailed Fundamental Analysis - TSLA,13-Oct-23
Tesla's (TSLA) EV Market Share Comes Down to 50% in Q3,13-Oct-23
The 4 Most Commonly Held Stocks Among Retail Investors,13-Oct-23
Tesla to offer German workers pay rise this year,12-Oct-23
"Coinbase and 2 More Overvalued Stocks to Avoid, Despite the Recent Pullback",12-Oct-23
Earnings Season Kicks Off Amid Busy Week,12-Oct-23
"Thursday's ETF Movers: LIT, XME",12-Oct-23
"US electric-vehicle sales hit record high, Tesla loses market share - report",12-Oct-23
Where Will Rivian Stock Be In 1 Year?,12-Oct-23
TSLA December 1st Options Begin Trading,12-Oct-23
3 EV Stocks That Need to Be on Your October Buy List,12-Oct-23
2 Reasons Tesla Stock Will Keep Driving Higher,12-Oct-23
"Pre-Market Most Active for Oct 12, 2023 :  TUP, SQQQ, TQQQ, DAL, WBA, ERIC, TSLA, LL, PLTR, NVDA, F, NOK",12-Oct-23
Guru Fundamental Report for TSLA,12-Oct-23
Best Growth Stocks: Rivian Stock vs. Tesla Stock vs. Nio Stock,12-Oct-23
"Zacks Investment Ideas feature highlights: Nvidia, Tesla and Novo Nordisk",12-Oct-23
US STOCKS-Futures rise as Treasury yields drop ahead of inflation data,12-Oct-23
Citigroup Maintains Tesla (TSLA) Neutral Recommendation,12-Oct-23
Time to Buy Stock in These Automotive Finance Leaders?,11-Oct-23
Should You Buy or Sell TSLA Stock Ahead of Oct. 18 Earnings?,11-Oct-23
3 EV Stocks To Make You The Millionaire Next Door: October Edition,11-Oct-23
3 Breakout Small-Cap Stocks Outperforming the Market,11-Oct-23
Column: Tesla shareholder lawyers defend $229 million fee bid in board pay case,11-Oct-23
"US STOCKS-Nasdaq rises as long-term Treasury yields retreat, Fed minutes awaited",11-Oct-23
The 3 Widest Competitive Moats on Wall Street,11-Oct-23
"Noteworthy ETF Inflows: ITOT, TSLA, LLY, JNJ",11-Oct-23
"US STOCKS-Wall St gains as long-term Treasury yields retreat, Fed minutes awaited",11-Oct-23
Analysts Estimate Tesla (TSLA) to Report a Decline in Earnings: What to Look Out for,11-Oct-23
"The Most Explosive EV Brand Out There, Buffett & Dalio Certified",11-Oct-23
"US STOCKS-Wall St eyes higher open as Treasury yields retreat, Fed minutes awaited",11-Oct-23
TSLA Factor-Based Stock Analysis,11-Oct-23
"US STOCKS-Futures gain as Treasury yields retreat; inflation data, Fed minutes awaited",11-Oct-23
"Ford, Hyundai turn to Italian casting machine maker IDRA",11-Oct-23
US STOCKS-Futures inch higher as Treasury yields retreat; Fed minutes awaited,11-Oct-23
1 Key Investing Metric Is Waving a Massive Green Flag for Tesla -- Time to Buy the EV Leader's Stock?,11-Oct-23
"A Bull Market Is Coming: 3 No-Brainer Stocks to Buy With $1,000 Right Now",11-Oct-23
"1 ""Magnificent Seven"" Stock to Buy Hand Over Fist in October and 1 to Avoid",11-Oct-23
UBS Maintains Tesla (TSLA) Neutral Recommendation,11-Oct-23
US SEC shortens stock disclosure deadline to 5 days,10-Oct-23
US STOCKS-Wall Street gains as Fed officials strike dovish tone,10-Oct-23
"Tesla rejects union claims, reports of health and safety issues at German plant",10-Oct-23
"Company News for Oct 10, 2023",10-Oct-23
TSLA Quantitative Stock Analysis,10-Oct-23
"Top Performing ETFs: Gold, Income ETFs Top the Charts",10-Oct-23
This Artificial Intelligence Stock Is Now Cathie Wood's Second-Largest Position -- and It's Not Palantir or Nvidia,10-Oct-23
Chart Storm: 6 Strong Technical Set-Ups for Q4,10-Oct-23
Only 29% of S&P 500 Stocks Are Beating the Index. Here's What It Means for Your Portfolio,10-Oct-23
Will Nio Continue to Underperform the Broader Markets?,10-Oct-23
1 Green Flag and 1 Red Flag for Lucid Group's Future,10-Oct-23
"Cathie Wood's Ark Invest Is Selling Tesla and Nvidia, and Buying 1 Little-Known Artificial Intelligence (AI) Growth Stock",10-Oct-23
"1 Stock-Split AI Growth Stock to Buy Now Before It Soars 860%, According to Cathie Wood's Ark Invest",10-Oct-23
Carmakers apply for French EV subsidies under more stringent rules,10-Oct-23
7 Options Trades to Make You Money in a Flat Market,9-Oct-23
3 Battery Stocks To Make You The Millionaire Next Door: October Edition,9-Oct-23
Tesla (TSLA) Stock Slides as Market Rises: Facts to Know Before You Trade,9-Oct-23
"Technology Sector Update for 10/09/2023: MTEK, DRS, CMTL, TSLA",9-Oct-23
Monday's ETF with Unusual Volume: SUSA,9-Oct-23
"Technology Sector Update for 10/09/2023: DRS, CMTL, TSLA",9-Oct-23
US STOCKS-Wall Street declines on Middle East conflict,9-Oct-23
Is Tesla Stock a Buy?,9-Oct-23
Wells Fargo Maintains Tesla (TSLA) Equal-Weight Recommendation,9-Oct-23
Tesla (TSLA) Slashes Prices of Model 3 & Model Y in the US,9-Oct-23
"Avoid This Overvalued EV Stock, Even at All-Time Lows",9-Oct-23
"EV Roundup: Q3 Deliveries of TSLA, RIVN, NIO, LI & XPEV in Focus",9-Oct-23
Electric Vehicles Are Future of Automotive Industry,9-Oct-23
3 Extraordinary Stocks to Buy and Hold Forever,9-Oct-23
"US STOCKS-S&P 500, Nasdaq fall on Middle East conflict",9-Oct-23
Time to Bank on Big Tech Again,9-Oct-23
ANALYSIS-Why Elon Musk might lose his latest battle with the SEC over Twitter probe,9-Oct-23
US STOCKS-Wall St eyes lower open on Middle East conflict,9-Oct-23
"Pre-Market Most Active for Oct 9, 2023 :  SQQQ, TQQQ, MRTX, TSLA, KDP, PLTR, QQQ, IONQ, NIO, OXY, XPEV, WMT",9-Oct-23
ANALYSIS-Elon Musk might lose his latest battle with the SEC over Twitter probe,9-Oct-23
US STOCKS-Futures lower as Middle East conflict sparks run for safe-haven assets,9-Oct-23
"Stocks Set to Open Lower as Investors Await U.S. Inflation Data and FOMC Minutes, Oil Soars on Middle East Conflict",9-Oct-23
Will BYD Leave Tesla In The Dust In EV Sales?,9-Oct-23
ANALYSIS-Why the SEC might win its latest battle with Elon Musk,9-Oct-23
US STOCKS-Futures down as Middle East conflict sparks run for safe-haven assets,9-Oct-23
"Huawei-backed Aito says gets 50,000 orders for M7 car since relaunch",9-Oct-23
Beijing Hyundai Motor cuts asking price for China auto plant by 30%,9-Oct-23
Beijing Hyundai cuts asking price for Chongqing auto plant by 30%,8-Oct-23
Tesla Just Missed on Its Delivery Target. Here's Why I Think the Stock Is Still a Buy.,8-Oct-23
"3 Magnificent Stocks With P/E Ratios Under 15, As Warren Buffett's Mentor Prefers",8-Oct-23
Tesla's China-made EV sales volume fall 10.9% y/y in Sept,8-Oct-23
"Cathie Wood Warns About a Hard Landing for the Economy, but Thinks Artificial Intelligence (AI) Could Come to the Rescue",8-Oct-23
"Cheaper Than Tesla: Up 53%, This Auto Stock Is Still a Screaming Buy",8-Oct-23
Tesla signs lease to open vast sales and service centre in Shanghai industrial park,7-Oct-23
1 EV Stock to Buy Hand Over Fist in October,7-Oct-23
"Top Analyst Reports for Tesla, Salesforce & McDonald's",6-Oct-23
"Technology Sector Update for 10/06/2023: OMQS, TSLA, MSFT, ATVI, PIXY",6-Oct-23
"Noteworthy Friday Option Activity: AEHR, TSLA, DPZ",6-Oct-23
3 Top Nasdaq Stocks to Add to Your Portfolio in October,6-Oct-23
"RIVN, LCID, MULN, NIO, or NKLA: Who’s Winning the EV Stocks Race?",6-Oct-23
"Technology Sector Update for 10/06/2023: TSLA, MSFT, ATVI, PIXY",6-Oct-23
"US STOCKS-Wall Street rebounds on megacaps boost, Treasury yields retreat",6-Oct-23
Broader Market Under Pressure on Fed Rate Hike Concerns,6-Oct-23
Should You Buy the Worst-Performing Nasdaq-100 Stock of 2023?,6-Oct-23
"Nasdaq 100 Movers: MDLZ, PDD",6-Oct-23
"US STOCKS-Wall Street drops after jobs data, eyes weekly losses",6-Oct-23
US STOCKS-Wall St eyes steep losses at open after jobs data; Treasury yields spike,6-Oct-23
"Is Trending Stock Tesla, Inc. (TSLA) a Buy Now?",6-Oct-23
Markets Today: Stocks Fall and Bond Yields Jump as U.S. Payrolls Surge,6-Oct-23
Ford's Drives Electric Vehicles To Best-Ever Quarterly Sales,6-Oct-23
Intel to Unlock Value By Spinning Off Programmable Chip Unit,6-Oct-23
"Pre-Market Most Active for Oct 6, 2023 :  SQQQ, TQQQ, RIVN, TSLA, TSLL, NOK, CSX, PLTR, PXD, XOM, HLN, LYG",6-Oct-23
UAW strike decision day comes as bargaining heats up,6-Oct-23
US STOCKS-Futures advance ahead of key jobs data,6-Oct-23
S&P Futures Climb as Investors Await Key U.S. Jobs Report,6-Oct-23
Hot Tip: Keep Expectations Low With This EV Charging Stock,6-Oct-23
UAW strike decision day comes as bargaining heats up,6-Oct-23
S&P Futures Tread Water as Investors Await Key U.S. Jobs Report,6-Oct-23
S&P Futures Tread Water as Investors Await Key U.S. Payrolls Data,6-Oct-23
"With Deliveries Missing Estimates, What's Next For Tesla Stock?",6-Oct-23
Is Rivian Stock Undervalued Following Surprisingly Strong Delivery Numbers?,6-Oct-23
"Tesla slashes prices of Model 3, Models Y vehicles in US",5-Oct-23
"SpaceX sued by engineer claiming underpayment of women, minorities",5-Oct-23
Tesla engineer defends 'Full Self-Driving' name at crash trial,5-Oct-23
"Tesla requests infrastructure ahead of Mexico factory construction, state govt says",5-Oct-23
2 Unusually Active Long-Duration Call Options I Really Like,5-Oct-23
"Tesla requests infrastructure ahead of Mexico factory construction, state govt says",5-Oct-23
US regulators push for recall of 52 million air bag inflators,5-Oct-23
These Are the 7 Stocks to Buy as Rates Keep Spiking,5-Oct-23
Tesla Stock Long-Term Forecast: Will the Shares Reach $500 by 2025?,5-Oct-23
3 EV Stocks Analysts Like Better Than Tesla,5-Oct-23
"Stock Market News for Oct 5, 2023",5-Oct-23
Kia EV Owners To Gain Access To Tesla Superchargers Across North America - Quick Facts,5-Oct-23
"Pre-Market Most Active for Oct 5, 2023 :  SQQQ, TQQQ, RIVN, TSLA, FCX, HLN, ARRY, QQQ, PLTR, NEE, TGT, NIO",5-Oct-23
Hyundai Motor to adopt Tesla EV-charging standard from 2024 in US,5-Oct-23
"Why Electric Vehicle Chip Stocks Aehr Test Systems, Axcelis Technologies, and Wolfspeed Fell in September",5-Oct-23
Wall St futures fall as worries over elevated Treasury yields remain,5-Oct-23
"US STOCKS-Futures fall ahead of key jobs data, worries over elevated Treasury yields remain",5-Oct-23
Sumitomo Metal sees global nickel supply surplus widening in 2024,5-Oct-23
"From Ukraine to Taiwan, satellite firms wrangle with geopolitics in space",5-Oct-23
Like TSLA? 3 Better Ways to Invest in Electric Vehicles,5-Oct-23
The 3 Top Growth Stocks to Watch in Q4 2023,4-Oct-23
What's Going On With Tesla Shares?,4-Oct-23
Zero-Day Options ETFs: A New Way to Generate Income,4-Oct-23
Why Tesla Rallied Today,4-Oct-23
"No new trial in ex-Tesla factory worker's racial harassment case, judge rules",4-Oct-23
Keep an Eye as XPeng Goes From EV Play to Flying Car Pick,4-Oct-23
"US STOCKS-Wall St gains after fresh jobs data, Treasury yields retreat",4-Oct-23
Wednesday's ETF with Unusual Volume: SUSA,4-Oct-23
F or TSLA: Which Is the Better Value Stock Right Now?,4-Oct-23
"US STOCKS-Nasdaq, S&P 500 rise after fresh jobs data, Treasury yields retreat",4-Oct-23
"S&P 500 Movers: PSX, TSLA",4-Oct-23
Analyzing Tesla's (TSLA) Potential Post Q3 Delivery Estimate Miss,4-Oct-23
3 Up-and-Coming Lithium Stocks to Put on Your Must-Buy List,4-Oct-23
"US STOCKS-Wall St eyes higher open after fresh jobs data, Treasury yields retreat",4-Oct-23
"Pre-Market Most Active for Oct 4, 2023 :  TQQQ, SQQQ, PLTR, QQQ, TLT, TSLA, AAPL, IONQ, NIO, LAAC, CCL, GOLD",4-Oct-23
"US STOCKS-Futures subdued ahead of jobs data, Treasury yields surge",4-Oct-23
"Bumpy September for auto ETFs as UAW strike, higher rates weigh",4-Oct-23
US STOCKS-Futures subdued on relentless rally in Treasury yields,4-Oct-23
1 Stock-Split Stock to Buy Hand Over Fist in October and 1 to Avoid,4-Oct-23
"Zacks Investment Ideas feature highlights: Tesla, Alphabet, Apple and NVIDIA",4-Oct-23
Column: Tesla bashes $229 million fee bid for plaintiffs in board pay case,3-Oct-23
Stocks Sink as the Rout in Government Bonds Deepens,3-Oct-23
Buy These 3 Stocks for Fortress Balance Sheets,3-Oct-23
UAW Strike: Windfall Victory for Tesla?,3-Oct-23
Zero-Day Options ETFs: A New Way to Generate Income,3-Oct-23
Truist Securities Maintains Tesla (TSLA) Hold Recommendation,3-Oct-23
Buy This ETF to Profit From the Semiconductor Industry's Water Crisis,3-Oct-23
US new vehicle sales jump in third quarter as UAW strike casts shadow,3-Oct-23
"US STOCKS-Wall St dives as jobs data fans rate worries, Treasury yields spike",3-Oct-23
Massive News for Tesla Stock and Rivian Stock Investors,3-Oct-23
Elon Musk must face fraud lawsuit for disclosing Twitter stake late,3-Oct-23
US STOCKS-Wall St slides as Treasury yields extend rally after jobs data,3-Oct-23
Tesla Re-launches RWD Model Y Variant In US At Cheaper Price,3-Oct-23
Q4 Stock Predictions: 3 EV Charging Stocks Ready to Roar Into 2024,3-Oct-23
US STOCKS-Wall St set for weak open as Treasury yields surge; jobs data in focus,3-Oct-23
"Pre-Market Most Active for Oct 3, 2023 :  ALXO, SQQQ, TQQQ, TSLA, QQQ, TLT, PLTR, NIO, NOK, F, NEE, IONQ",3-Oct-23
Truist Securities Maintains Tesla (TSLA) Hold Recommendation,3-Oct-23
US STOCKS-Futures fall as 10-year yields hit fresh 16-yr highs; jobs data in focus,3-Oct-23
"GRAPHIC-Tech giants' market cap dips on rising bond yields, AI caution",3-Oct-23
Bull vs. Bear: What Tesla Stock Analysts Are Saying Now,3-Oct-23
US STOCKS-Futures subdued ahead of key jobs data as rate worries keep yields high,3-Oct-23
GM Stock: Time to Back Up the Truck?,3-Oct-23
"Unusual Put Option Trade in Tesla (TSLA)  Worth $100,900.00K",2-Oct-23
"What Nvidia, Broadcom, and Tesla Stock Investors Should Know About Recent Updates",2-Oct-23
Tesla (TSLA) Outpaces Stock Market Gains: What You Should Know,2-Oct-23
"US STOCKS-S&P 500 ends near flat; utilities drop, focus on rate outlook",2-Oct-23
Tesla scores Autopilot victory as judge rules owners must use arbitration,2-Oct-23
US STOCKS-S&P 500 ends near flat; focus on outlook for higher rates,2-Oct-23
1 Cathie Wood Stock with 65% Upside Potential,2-Oct-23
US STOCKS-Nasdaq rises on boost from growth stocks; Fed comments in focus,2-Oct-23
Strong earnings will reverse decline in megacap tech stocks: Goldman Sachs,2-Oct-23
Stocks Mixed on Higher Bond Yields and Strength in Big Tech,2-Oct-23
"US STOCKS-Nasdaq, S&P 500 rise ahead of comments from Fed Chair Powell",2-Oct-23
EV maker Rivian beats quarterly delivery estimates after raising production,2-Oct-23
Tesla Q3 Vehicle Production And Deliveries Decline Sequentially,2-Oct-23
Markets Today: Stocks Slip as Bond Yields Resume Their Climb,2-Oct-23
"Tesla reports fall in third-quarter deliveries, misses estimates",2-Oct-23
"Tesla reports fall in third-quarter deliveries, misses estimates",2-Oct-23
EV maker Rivian beats Q3 delivery estimates after raising production,2-Oct-23
TSLA Crosses Above Average Analyst Target,2-Oct-23
"US new auto sales likely rose in Q3, but UAW strikes may pose speed bump",2-Oct-23
"Crude Inventories, Jobs and Other Market Moving Items to Watch This Week",1-Oct-23
Tesla's Competition Is Here. Or Is It?,1-Oct-23
Wall St Week Ahead-US stock market’s powerhouses tested by soaring bond yields,1-Oct-23
3 Robinhood Stocks to Buy and Hold Forever,1-Oct-23
"Tesla’s about to report Q3 deliveries; Don’t get too hung up on the number, says this analyst",1-Oct-23
"Got $5,000? These Are 2 of the Best Growth Stocks to Buy Right Now.",1-Oct-23
"Tesla launches updated Model Y in China, keeps starting price unchanged",1-Oct-23
Tesla Deliveries: What to Expect,30-Sep-23
Is Tesla Stock a Buy Now?,30-Sep-23
Stock Split Watch: Is Regeneron Pharmaceuticals Next?,30-Sep-23
1 Mistake to Avoid as a Beginner in the Stock Market,30-Sep-23
Why Shares of Rivian Automotive Shot Higher This Week,29-Sep-23
Why Velo3D Stock Skyrocketed Today,29-Sep-23
Where Will Rivian Stock Be in 5 Years?,29-Sep-23
Play Online Car Sales News in China ETF DUO,29-Sep-23
"Noteworthy Friday Option Activity: TSLA, DPZ, XOM",29-Sep-23
3 Top Lithium Mining Stocks to Buy for Stellar Long-Term Gains,29-Sep-23
"US STOCKS-S&P 500, Nasdaq gain as softer PCE data supports rate-pause hopes",29-Sep-23
Why Rivian Automotive Stock Popped on Friday,29-Sep-23
Piper Sandler Reiterates Tesla (TSLA) Overweight Recommendation,29-Sep-23
US STOCKS-Wall St eyes higher open as softer PCE data supports rate-pause hopes,29-Sep-23
PayPal Keeps Getting Cheaper; Should You Load Up?,29-Sep-23
"Pre-Market Most Active for Sep 29, 2023 :  TQQQ, SQQQ, APRN, TSLA, NIO, PLTR, BNOX, GPCR, NKE, CCL, IONQ, XPEV",29-Sep-23
"Why The Likes Of Tesla, Toyota, Are The Winners From UAW Strikes",29-Sep-23
EXPLAINER-Why is France raiding a graphics card company?,29-Sep-23
US STOCKS-Futures rise as Treasury yields take a breather; eyes on inflation data,29-Sep-23
EXPLAINER-Why is France raiding a graphics card company?,29-Sep-23
Better Buy: Rivian vs. Lucid Group Stock,29-Sep-23
Canaccord Genuity Reiterates Tesla (TSLA) Buy Recommendation,29-Sep-23
Revving Up Rivian: Why This Analyst Believes RIVN Stock Is a Steal,29-Sep-23
"Cathie Wood Says Robotaxis Are the Investment Opportunity of a Lifetime, and Ark Is Betting Big on 2 Artificial Intelligence (AI) Growth Stocks",29-Sep-23
"PREVIEW-Tesla's deliveries expected to fall on plant shutdowns, soft demand",29-Sep-23
1 EV Stock to Buy Hand Over Fist Right Now (Hint: It's Not Tesla or Rivian),29-Sep-23
These 3 Tech Stocks Are Building the Future,29-Sep-23
TSLA and NKE: What’s Ahead for These Buzzing Reddit Stocks?,29-Sep-23
What's New With Tesla Stock?,28-Sep-23
Morgan Stanley Reiterates Tesla (TSLA) Overweight Recommendation,28-Sep-23
Tesla sued by US agency over alleged harassment of Black factory workers,28-Sep-23
What to Note in the AI Megatrend,28-Sep-23
Tesla trial over Autopilot fatality kicks off in California,28-Sep-23
US STOCKS-Wall St climbs after investors digest slew of economic data,28-Sep-23
November 10th Options Now Available For Tesla (TSLA),28-Sep-23
2 AI Stocks to Keep on Your Watch List,28-Sep-23
The Autoworkers' Strike Through an Investor's Lens,28-Sep-23
"EXCLUSIVE-China's Nio explores investment, tech alliances with Mercedes",28-Sep-23
US STOCKS-Wall St set for lower open on rate jitters; Powell on deck,28-Sep-23
Should You Still Buy the Nasdaq's Best-Performing Stocks?,28-Sep-23
Auto Strike Not a Large Strike Out for EV ETFs,28-Sep-23
"EXCLUSIVE-China's Nio explores investment, tech alliances with Mercedes - sources",28-Sep-23
Is Enphase Energy Stock Too Cheap to Ignore?,28-Sep-23
US STOCKS-Futures decline as soaring oil prices deepen inflation woes,28-Sep-23
2 Ultra-Growth Stocks That Are Leading the Market Recovery,28-Sep-23
Tesla trial over Autopilot fatality kicks off in California,28-Sep-23
"Wall Street's ""Magnificent Seven"" May Be a Mammoth Liability for the Stock Market",28-Sep-23
Beyond Cars: Top 3 EV-Related Stocks to Invest In Now,27-Sep-23
Don’t Miss the Boom: 3 EV Stocks Set to Explode Higher,27-Sep-23
Stocks Settle Mixed as Bond Yields Grind Higher,27-Sep-23
Tesla Shares Major Updates About Its AI Robot -- Time to Buy Tesla Stock?,27-Sep-23
"Buy This, Not That: 3 EV Stocks to Own, 2 to Avoid",27-Sep-23
"""The Great Reshuffle"": 3 Winning Technologies",27-Sep-23
"Wednesday Sector Laggards: Utilities, Consumer Products",27-Sep-23
Lucid opens first international EV factory in Saudi Arabia,27-Sep-23
US STOCKS-Wall St eyes higher open after previous session's mauling,27-Sep-23
"The Zacks Analyst Blog Highlights Tesla, BYD, NIO and Honda",27-Sep-23
"Pre-Market Most Active for Sep 27, 2023 :  TQQQ, SQQQ, MUFG, TSLA, PLTR, TLRY, AMZN, QQQ, IONQ, NIO, CCL, CHPT",27-Sep-23
Prediction: These Will Be 2 of the Most Valuable Stocks by 2035 Thanks to This Multitrillion-Dollar Opportunity,27-Sep-23
Ford (F) Pauses $3.5B Battery Plant Amid EV Tech Conundrum,27-Sep-23
"What Amazon, Tesla, and AMD Stock Investors Should Know About Recent AI Updates",27-Sep-23
US STOCKS-Futures bounce back after Wall Street rout,27-Sep-23
COLUMN-'Unknown unknowns' unnerving markets for Q4,27-Sep-23
ANALYSIS-Tesla's rivals scrap for thin slices of US EV sales,27-Sep-23
US lawmakers demand documents on Ford battery partnership with CATL,27-Sep-23
COLUMN-'Unknown unknowns' unnerving markets for Q4,27-Sep-23
Tesla working on 'gigacasting' tech to mould underbody in one piece -report,26-Sep-23
JPMorgan sees India in its top 3 fastest-growing Asia markets in 2024,26-Sep-23
The 3 Best EV Stocks in the Entire Market Right Now,26-Sep-23
"Technology Sector Update for 09/26/2023: SOUN, AMZN, TSLA, HPE",26-Sep-23
Wait! Don’t Buy Tesla Stock Before This Crucial Date.,26-Sep-23
RBC Capital Reiterates Tesla (TSLA) Outperform Recommendation,26-Sep-23
"Technology Sector Update for 09/26/2023: AMZN, TSLA, HPE",26-Sep-23
Tuesday's ETF with Unusual Volume: SPGM,26-Sep-23
Why Uranium ETFs Are Going Nuclear,26-Sep-23
Why Fisker Stock Is in the Fast Lane Today,26-Sep-23
Don’t Miss the Boom: 3 Flying Car Stocks Set to Explode Higher,26-Sep-23
This Is the Holy Grail of Investing,26-Sep-23
Where Will Lucid Motors Stock Be in 5 Years?,26-Sep-23
Ford (F) Strikes a Three-Year Collective Agreement With Unifor,26-Sep-23
"EV Roundup: BYDDY Hits Milestone, HMC Launches Lingxi EV & More",26-Sep-23
US STOCKS-Wall St declines as rate worries keep Treasury yields elevated,26-Sep-23
JPMorgan sees India in its top 3 fastest-growing Asia markets in 2024,26-Sep-23
Markets Today: Stocks Slip on Additional Hawkish Fed Comments,26-Sep-23
US STOCKS-Wall St poised for weak open as rate worries keep Treasury yields elevated,26-Sep-23
Fortune’s Forecast: Top 3 Stocks Set to Dominate the Next Decade,26-Sep-23
"Pre-Market Most Active for Sep 26, 2023 :  IMVT, SQQQ, TQQQ, TSLA, ROIV, SIRI, NIO, CRH, PLTR, IONQ, FSR, BEKE",26-Sep-23
US STOCKS-Futures drop as rate worries keep Treasury yields near recent peaks,26-Sep-23
"If You Bought $1,000 Worth of Tesla Stock at the Start of the Year, Here's How Much You Would Have Today",26-Sep-23
US STOCKS-Futures drop as rate concerns keep Treasury yields elevated,26-Sep-23
Investor Alert: Is Li Auto’s Hybrid Model a Buy Before Full EV Shift?,26-Sep-23
Tesla to face EU anti-subsidy probe over China exports- FT,26-Sep-23
3 High-Flying Artificial Intelligence (AI) Stocks Billionaires Are Aggressively Selling,26-Sep-23
Will Tesla's Booming Energy Storage Business Help Its Stock?,26-Sep-23
Time to Buy or Stay Clear of General Motors and Ford Stock as UAW Strike Continues?,25-Sep-23
USMC: Bigger is Better with This Mega-Cap ETF,25-Sep-23
September’s 7 Most Controversial EV Stocks: Buy or Bail?,25-Sep-23
"US STOCKS-S&P 500, Nasdaq gain as megacaps rebound; rate concerns prevail",25-Sep-23
Tesla Stock (NASDAQ:TSLA): Delving into the EV Giant’s Ownership Structure,25-Sep-23
Why Li Auto Stock Sank 10% on Monday,25-Sep-23
The Consumer Discretionary Select Sector SPDR Fund Experiences Big Inflow,25-Sep-23
US STOCKS-Wall Street subdued on lingering concerns over elevated rates,25-Sep-23
UAW Strike Escalates: Who Stands to Gain and Lose?,25-Sep-23
