title,date
Tesla (TSLA) Rises As Market Takes a Dip: Key Facts,3 hours ago
Automakers question feasibility of California 2035 EV sales mandate plan,6 hours ago
Should Nvidia Become the Next Dow Jones Stock After Amazon?,6 hours ago
Chinese carmaker BYD launches low-cost Dolphin Mini EV in Mexico,7 hours ago
"EXCLUSIVE-US law on domestic abuse should cover carmakers, FCC chair says",10 hours ago
"US law on domestic abuse should cover carmakers, FCC chair says",10 hours ago
"Polestar raises almost $1 bln, sees margins improving in 2024",10 hours ago
TSLA Factor-Based Stock Analysis,13 hours ago
"Only 3 of the ""Magnificent Seven"" Stocks Have Been 10-Baggers Over the Past 10 Years",13 hours ago
Is Nuveen ESG Large-Cap Growth ETF (NULG) a Strong ETF Right Now?,15 hours ago
Don't Buy EV Stocks (Including Tesla) Until You See This,15 hours ago
"1 Unstoppable Multibagger Up 950% in the Last Decade That Is Secretly Powering the ""Magnificent Seven""",15 hours ago
Will Reaching Positive Gross Profit Be Enough to Turn Rivian Stock Around?,15 hours ago
"Meet the 2 ""Magnificent Seven"" Stocks Currently Held in Warren Buffett's $621 Million ""Secret"" Portfolio",16 hours ago
BYD amps up brutal China EV price war with bigger discounts on new car versions,17 hours ago
"Tesla aims to ship Roadster cars next year, Musk says",19 hours ago
Siblings help China's BYD grab early lead in Thai EV market,1 day ago
US STOCKS-Wall Street wavers ahead of key inflation data,1 day ago
"What’s Wrong with Rivian Stock, and Will RIVN Recover and Go Back Up?",1 day ago
"Hybrids, gas vehicles fuel legacy automakers' shares past EV rivals",1 day ago
UAW says majority of workers at Mercedes Benz US plant seek to join union,1 day ago
US STOCKS-Dow leads Wall Street declines ahead of economic data,1 day ago
"Electrified vehicles are becoming more popular in US, survey says",1 day ago
"2 ""Magnificent Seven"" Stocks to Buy Before They Soar 78% and 80%, According to Select Wall Street Analysts",1 day ago
US STOCKS-Wall Street set for muted open ahead of economic data,1 day ago
"Better ""Magnificent Seven"" Buy: Nvidia or Tesla",1 day ago
"Pre-Market Most Active for Feb 27, 2024 :  SOUN, LUNR, SQQQ, BBAI, U, IBIT, TSLA, NCLH, TQQQ, NIO, GOTU, CCL",1 day ago
TSLA Quantitative Stock Analysis,1 day ago
US STOCK-Futures edge up ahead of economic data,1 day ago
"Forget Nvidia: These 3 Artificial Intelligence (AI) Stocks Have Up to 203% Upside, According to Select Wall Street Analysts",1 day ago
Why Tesla Stock Motored Nearly 4% Higher Today,2 days ago
Lucid Rallied Today -- Is It Time to Buy the EV Stock?,2 days ago
3 Starter Buy-and-Hold Stocks Every New Investor Should Own,2 days ago
"Why Is Nvidia Stock So High, and Can NVDA Become the Biggest U.S. Company?",2 days ago
Nvidia bets dominate US options market as AI fervor grows,2 days ago
Why Rivian Stock Bounced Higher Today,2 days ago
US STOCKS-Wall St struggles for direction ahead of inflation test,2 days ago
PCAR or TSLA: Which Is the Better Value Stock Right Now?,2 days ago
"Forget Tesla: I Think This Stock Should Replace It in the ""Magnificent Seven""",2 days ago
"Rising to the Challenge: This Aspiring ""Magnificent Seven"" Stock Is One to Watch in 2024",2 days ago
Is Tesla Stock a Buy in 2024?,2 days ago
The Magnificent Seven in 2024: Consider Active Blue Chip ETF TCHP,2 days ago
The Green Revolution: 3 EV Stocks Charging Ahead of the Competition,2 days ago
3 Things You Need to Know If You Buy Rivian Today,2 days ago
"Here's the Only ""Magnificent Seven"" Stock That's Not Overpriced, According to the ""Dean of Valuation""",2 days ago
Opinion: The Tesla Growth Story Is Officially Dead,2 days ago
Japan's Kobe Steel eyes auto panel JV with China Baowu,2 days ago
"PREVIEW-Facing Chinese EV rivals, Europe's automakers squeeze suppliers on costs",2 days ago
GM returns to France with fully-electric Cadillac Lyriq,2 days ago
TSLA Stock Analysis: Where Will Tesla Be in 10 Years?,3 days ago
3 Hidden-Gem Electric Vehicle Stocks Ready to Ride a Massive Market Wave,3 days ago
Guru Fundamental Report for TSLA,3 days ago
Sector Standouts: 3 EV Stocks That Wall Street Loves,3 days ago
"This Electric Vehicle Stock Has 75% Upside, According to 1 Wall Street Analyst",3 days ago
Vietnam's VinFast seeks India EV import duty cut as plant construction starts,3 days ago
"Move Over, BYD. Li Auto Looks Ready to Take EV Market Share.",4 days ago
History Says the Nasdaq Could Soar in 2024: 1 Artificial Intelligence (AI) Stock to Buy Hand Over Fist Before It Does,4 days ago
1 Unfavorable Trend Explains the 21% Plunge in Tesla Stock in 2024,4 days ago
"Which ""Magnificent Seven"" Stock Is Poised for the Most Spectacular Growth? Here's the Hands-Down Winner.",4 days ago
"US should block cheap Chinese auto imports from Mexico, US makers say",4 days ago
"US STOCKS-S&P, Dow eke out another record closing high as Nvidia momentum endures",5 days ago
"US STOCKS-S&P, Dow edge to another record closing high as Nvidia momentum endures",5 days ago
"US should block low-cost Chinese automaker imports from Mexico, says manufacturers' group",5 days ago
"Tesla Cancels Pie Orders Last Minute, Hurting Small Business",5 days ago
"US STOCKS-AI-led rally on Wall Street loses steam, Nvidia pares gains",5 days ago
Why Is Tesla (TSLA) Up 8.1% Since Last Earnings Report?,5 days ago
"Noteworthy ETF Inflows: QQQM, TSLA, TMUS, AMAT",5 days ago
US STOCKS-Wall St set for muted open after scorching AI-led rally,5 days ago
Validea Detailed Fundamental Analysis - TSLA,5 days ago
US STOCKS-Futures subdued after scorching AI-led rally,5 days ago
US STOCKS-Futures take breather after scorching AI-led rally,5 days ago
Is Tesla a Millionaire Maker?,5 days ago
"Bull of the Day: Cadence Design Systems, Inc. (CDNS)",5 days ago
"Tesla to fix software in 8,700 vehicles in China product recall, regulator says",5 days ago
Tesla (TSLA) Increases Yet Falls Behind Market: What Investors Need to Know,6 days ago
"Noteworthy Thursday Option Activity: TSLA, PRG, GSHD",6 days ago
"Unfortunate News for Ford Stock, Tesla Stock, and Rivian Stock Investors",6 days ago
3 Mega-Cap Stocks That Could Replace Tesla in the 'Magnificent Seven',6 days ago
"EV sector grapples with layoffs, production cuts and altered plans",6 days ago
Ford (F) Slashes 2023 Mustang Mach-E Prices to Boost Sales,6 days ago
"Rivian, Lucid tumble as slowing EV demand upsets ramp-up plans",6 days ago
US STOCKS-Wall Street sprints towards higher open on Nvidia's mega rally,6 days ago
Trading Alert: February 22nd Iron Condor Screener Results,6 days ago
Guru Fundamental Report for TSLA,6 days ago
US STOCKS-Nvidia's mega rally drives Nasdaq futures 2% higher,6 days ago
"Chinese electric truck start-up Windrose explores production in Europe, CEO says",6 days ago
Should You Invest in the iShares U.S. Consumer Discretionary ETF (IYC)?,6 days ago
It’s a Great Time to Buy EV Stocks. TSLA Is Another Story.,6 days ago
"Rivian, Lucid's 2024 production targets disappoint as EV demand wanes",6 days ago
US STOCKS-Nasdaq futures jump nearly 2% after Nvidia trounces expectations,6 days ago
"3 ""Magnificent Seven"" Stocks Billionaires Are Selling, and the 1 They Can't Stop Buying",6 days ago
"Nvidia stock surges as revenue forecast tops estimates, AI demand continues",21-Feb-24
Column: Elon Musk gets some guidance from a Delaware judge on how to ditch the state,21-Feb-24
Slow and Steady: 3 Stocks Targeting 50% Growth by 2030,21-Feb-24
3 EV Charging Stocks That Could Be Multibaggers in the Making: February Edition,21-Feb-24
3 Stocks With the Potential to Knock Tesla Out of the Magnificent 7,21-Feb-24
Wall Street Favorites: 3 Lithium Stocks With Strong Buy Ratings for February 2024,21-Feb-24
"Slow Down, Big Shifter! 3 Stocks That Are Moving Too Far, Too Fast.",21-Feb-24
Looking for Long-Term Value? 3 Stocks With a Strong Return on Invested Capital (ROIC),21-Feb-24
"3 EV Stocks to Turn $10,000 Into $1 Million- February 2024",21-Feb-24
RIVN Stock Analysis: Why Rivian’s Momentum Looks Unstoppable,21-Feb-24
TSLA Factor-Based Stock Analysis,21-Feb-24
Another Swedish union warns of action against Tesla,21-Feb-24
3 Stocks I'm Glad I Didn't Fall in Love With,21-Feb-24
"S&P Futures Slip Ahead of FOMC Meeting Minutes, Nvidia Earnings on Tap",21-Feb-24
Weakness in Tech Stocks Drags the Overall Market Lower,20-Feb-24
Why Lucid Group Stock Tumbled on Tuesday,20-Feb-24
Can Dividend Kings Outperform the Magnificent 7 ETF?,20-Feb-24
"Why Tesla, Fisker, and QuantumScape Are Dropping Today",20-Feb-24
Stocks close lower as Nvidia weighs ahead of earnings,20-Feb-24
US STOCKS-Stocks close lower as Nvidia weighs ahead of earnings,20-Feb-24
Nvidia dethrones Tesla as Wall Street's most traded stock,20-Feb-24
Tesla faces rejection from locals for plans to expand German site,20-Feb-24
Stocks Under Pressure from Tech Stocks and Nvidia,20-Feb-24
Nasdaq leads Wall St losses as Nvidia slides; Walmart hits record high,20-Feb-24
US STOCKS-Nasdaq leads Wall St losses as Nvidia slides; Walmart hits record high,20-Feb-24
Tuesday's ETF with Unusual Volume: IUS,20-Feb-24
Stocks Slip as Weakness in Nvidia Drags Tech Stocks Lower,20-Feb-24
Ford cuts prices of all variants of Mustang Mach E electric SUV,20-Feb-24
"Tesla, Inc. (TSLA) is Attracting Investor Attention: Here is What You Should Know",20-Feb-24
"Will Smith-backed Arc launches mass-market electric sport boat for $258,000",20-Feb-24
US STOCKS-Wall St set to open lower as early rate cut hopes fade; Walmart perks up,20-Feb-24
"EV Investing Takes Lumps, Still Has Vast Potential",20-Feb-24
TSLA Quantitative Stock Analysis,20-Feb-24
Is Upstart Holdings a Millionaire Maker?,20-Feb-24
US STOCKS-Futures ease on fading rate cut hopes; Walmart rises on strong sales forecast,20-Feb-24
Stocks Set to Open Lower as Investors Await FOMC Minutes and Nvidia Earnings,20-Feb-24
"GRAPHIC-Eli Lilly, Novo Nordisk get growth stock status on weight-loss drug boost",20-Feb-24
Should You Invest in the Vanguard Consumer Discretionary ETF (VCR)?,20-Feb-24
US STOCKS-Futures slip on fading rate cut hopes; retailers' earnings in focus,20-Feb-24
Where Will Tesla Be in 10 Years?,20-Feb-24
Is Ford Motor Company a Millionaire Maker?,20-Feb-24
EV Stock Shuffle: 2 to Buy and 2 to Sell Before Summer Hits,20-Feb-24
INSIGHT-How a Chinese rocket failure boosted Elon Musk's SpaceX in Indonesia,19-Feb-24
3 Battery Stocks That Could Be Multibaggers in the Making: February Edition,19-Feb-24
3 Stocks You Can Buy to Bet on the IONNA EV Charging Network,19-Feb-24
Reuters wins Polk Award for coverage of Elon Musk’s business empire,19-Feb-24
Consolidation or Collapse? NIO’s Future Is Uncertain Amid China’s EV Crackdown.,19-Feb-24
"The ""Dean of Valuation"" Is Selling Nvidia Stock Hand Over Fist. Should You?",19-Feb-24
"Chinese EV maker Xpeng to hire 4,000, invest in AI",19-Feb-24
Tesla Should Start Doing These Things,18-Feb-24
Wall St Week Ahead-High-flying Nvidia’s earnings could test US stock market’s AI dreams,18-Feb-24
Guru Fundamental Report for TSLA,18-Feb-24
"Forget Rivian, Buy This Magnificent Electric Vehicle (EV) Stock Instead",17-Feb-24
Retail Earnings Loom: What's in 'Store'?,16-Feb-24
3 Stocks That Cathie Wood Is Loving Now: February 2024,16-Feb-24
My Top 3 Stock Candidates to Replace Tesla in the Magnificent 7,16-Feb-24
SMCI: Shades of QCOM in 99'?,16-Feb-24
"Pre-Market Most Active for Feb 16, 2024 :  HTOO, SOUN, TSLA, SQQQ, LUNR, TSLL, NIO, BE, PLTR, TOST, IONQ, BABA",16-Feb-24
Tesla Has Problems. Could QuantumScape Be a Good Choice for Growth Investors?,16-Feb-24
The Next Apple? 3 Tech Stocks That Investors Shouldn’t Ignore.,16-Feb-24
Validea Detailed Fundamental Analysis - TSLA,16-Feb-24
"Here's How Much Money You'd Have if You Invested $7,000 in the ""Magnificent Seven"" in 2017",16-Feb-24
"Move Over, Magnificent 7! AMD Stock Deserves the Spotlight Now.",16-Feb-24
Better Buy in 2024: Rivian or Tesla Stock?,16-Feb-24
Handicapping the Earnings Outlook,15-Feb-24
"Noteworthy Thursday Option Activity: OXY, TSLA, WFC",15-Feb-24
"QQQM, TSLA, ADBE, TMUS: Large Inflows Detected at ETF",15-Feb-24
Meet the Next Trillion-Dollar Companies: Our Top 7 Picks,15-Feb-24
Guru Fundamental Report for TSLA,15-Feb-24
"Zacks Earnings Trends Highlights: Alphabet, Microsoft, Meta, Nvidia and Tesla",15-Feb-24
Bitcoin Is Worth a Trillion Dollars Again. Here Are 4 Different Ways to Invest in the Largest Cryptocurrency.,15-Feb-24
3 Short-Squeeze Stocks That Could Make Your February Unforgettable,15-Feb-24
This Under-the-Radar Stock Bought Back 17% of Its Own Stock in 2023,15-Feb-24
AAPL Stock Outlook: Pick Up the Phone! $200 Is Calling.,15-Feb-24
ANALYSIS-Biden's drive for EVs collides with Detroit's profit machines,15-Feb-24
"1 Nasdaq-100 Stock That's a Screaming Buy in February, and 1 to Avoid",15-Feb-24
Biden Boom: 7 Stocks to Buy if Democrats Win the Election in 2024,14-Feb-24
Q4 Results Paint a Positive Earnings Picture,14-Feb-24
Q4 Results Paint a Positive Earnings Picture,14-Feb-24
The Millionaire’s Shortcut: 3 Stocks to Speed Up Your Wealth Journey,14-Feb-24
"Despite weak lithium prices, Albemarle beats on cost cuts",14-Feb-24
"US STOCKS-Wall Street ends higher, lifted by Uber, Lyft and Nvidia",14-Feb-24
"Wall Street ends higher, lifted by Uber, Lyft and Nvidia",14-Feb-24
Get Rich Quick With These 3 EV Stocks to Buy Now,14-Feb-24
Get Rich Quick With These 3 Machine Learning Stocks to Buy Now,14-Feb-24
"US STOCKS-Wall Street climbs, lifted by Uber, Lyft and Nvidia",14-Feb-24
Tesla's Cybertruck Faces Rust Problems,14-Feb-24
The 3 Best Lithium Stocks to Buy in February 2024,14-Feb-24
US auto retailers' falling new vehicle margins compress quarterly profits,14-Feb-24
"Renault posts lower-than-expected FY profit, ups dividend",14-Feb-24
Is Tesla Stock a Buy?,14-Feb-24
"Musk, Tesla shareholder to propose a stay of pay ruling during appeal - court filing",14-Feb-24
Swedish union to exempt some Tesla cars from mechanic strike,14-Feb-24
Market Crash Got You Down? Try These Three Bearish Option Trades,14-Feb-24
TSLA Factor-Based Stock Analysis,14-Feb-24
3 High-Momentum Stocks to Add to Your Watchlist,14-Feb-24
"EXPLAINER-Did Delaware 'lock the doors' to stop companies from leaving, as Musk claims?",14-Feb-24
ChatGPT Stock Predictions: 3 Companies the AI Bot Thinks Have 10X Potential,14-Feb-24
OpenAI researcher Andrej Karpathy departs firm,13-Feb-24
Rebirth of the Roaring 20s: 3 Stocks Ready to Ride the Economic Boom,13-Feb-24
Will Nvidia Keep Going Up in 2024 as Stock Split Chatter Grows?,13-Feb-24
7 Stocks Cathie Wood Is Still Loading Up On in Q1,13-Feb-24
"China's BYD plans new electric vehicle plant in Mexico, says Nikkei",13-Feb-24
German labour court finds Tesla broke union election rules,13-Feb-24
Wall St falls as hot inflation data dampens early rate-cut hopes,13-Feb-24
1 Incredibly Cheap Stock to Buy With $500 Right Now,13-Feb-24
Is Rivian the Best Electric Vehicle Stock for You?,13-Feb-24
US STOCKS-Wall St slides as hot inflation data dampens early rate-cut hopes,13-Feb-24
US STOCKS-Wall St to open lower as hot inflation data stokes rate-cut uncertainty,13-Feb-24
Is Tesla a Millionaire Maker?,13-Feb-24
TSLA Quantitative Stock Analysis,13-Feb-24
Tesla (TSLA) Stock: Another Reason to Buy The Pullback,13-Feb-24
"MORNING BID AMERICAS-Nikkei and Nasdaq stalk records, CPI lurks",13-Feb-24
RIVN Stock Outlook: Should You Buy the Dip on Rivian?,13-Feb-24
The Only 3 Magnificent 7 Stocks Still Worth Buying in 2024,13-Feb-24
"Forget Tesla, Buy This Magnificent Auto Stock Instead",13-Feb-24
Why Investors Were Electrified by EV Battery and Charging Stocks Today,12-Feb-24
Stocks Settle Mixed Ahead of Tuesday’s U.S. CPI Report,12-Feb-24
Tesla Offers Discount On Select Model Y EVs For Limited Period In US,12-Feb-24
2 Phenomenal Artificial Intelligence (AI) Stocks Using Nvidia's Technologies That I Can't Stop Buying,12-Feb-24
Court Orders Elon Musk To Testify In SEC's Twitter Probe,12-Feb-24
Magnificent Seven Spurs S&P 500 to 5000,12-Feb-24
4 Best ETF Areas of Last Week,12-Feb-24
3 Millionaire-Maker Stocks to Buy While the Gettin’ Is Good,12-Feb-24
"Nvidia Is Now Worth More Than Berkshire Hathaway, Tesla, and AMD Combined. But Will It Last?",12-Feb-24
Robot invasion hit a bump in 2023 as North American economy cooled,12-Feb-24
Wall Street's Next Stock-Split Stocks Are Liable to Be Familiar Names,12-Feb-24
Should You Buy Tesla While It's Below $200?,12-Feb-24
US judge orders Elon Musk to testify in SEC's Twitter probe,11-Feb-24
The Truth About Tesla Stock: Should You Buy Now?,11-Feb-24
The Worst-Performing S&P 500 Stock in 2024: Will It Be Tesla?,11-Feb-24
Wall St Week Ahead-Market breadth suggests narrowing rally as S&P 500 hits records,11-Feb-24
Guru Fundamental Report for TSLA,11-Feb-24
Tesla temporarily slashes prices for some Model Y cars in the US,10-Feb-24
The 3 Most Undervalued Battery Stocks to Buy in February 2024,10-Feb-24
3 EV Stocks to Buy for the Next Bull Run: February 2024,10-Feb-24
5 Standout Features of the Q4 Earnings Season,9-Feb-24
Musk's Neuralink switches location of incorporation - Bloomberg News,9-Feb-24
3 Must-Own Growth Stocks as Consumer Confidence Sweeps Wall Street,9-Feb-24
Is It Really Just the Magnificent 7 Propping Up This Market?,9-Feb-24
"Tesla, Inc. (TSLA) Is a Trending Stock: Facts to Know Before Betting on It",9-Feb-24
"Pre-Market Most Active for Feb 9, 2024 :  ERIC, SQQQ, PLTR, TQQQ, NET, AFRM, ARM, TSLA, DOOR, PINS, NIO, BABA",9-Feb-24
Validea Detailed Fundamental Analysis - TSLA,9-Feb-24
Why LI Stock Remains the Top Choice Among China EV Plays,9-Feb-24
"1 Artificial Intelligence (AI) Growth Stock to Buy Before It Soars 170%, According to a Wall Street Analyst",9-Feb-24
COLUMN-Parallel universes? 'Magnificent 7' prone to China risks :Mike Dolan,9-Feb-24
Elon Musk's X taps small D.C. law firm for free-speech battles,8-Feb-24
Tesla trails Ford and GM in revenue generated per worker,8-Feb-24
Thursday's ETF with Unusual Volume: FTC,8-Feb-24
3 Battery Stocks With Serious Potential to Make You a Millionaire,8-Feb-24
"Toyota (TM) Breezes Past Q3 Earnings Estimates, Lifts FY24 View",8-Feb-24
Guru Fundamental Report for TSLA,8-Feb-24
"S&P 500 About to Hit 5,000: More Reasons for Further ETF Rally",8-Feb-24
3 Up-and-Coming EV Giants You Can Ride to the Finish Line,8-Feb-24
"The 3 Best-Performing Stocks in the S&P 500 Over the Last 10 Years Might Surprise You (They Don't Include Apple, Microsoft, or Tesla)",8-Feb-24
"The Zacks Analyst Blog Highlights Tesla, Broadcom, McDonald's, Automatic Data Processing and CSX",8-Feb-24
"Zacks Earnings Trends Highlights: Tesla, Microsoft, Apple and Nvidia",8-Feb-24
LG Energy plans to sell batteries to more EV car makers in India,8-Feb-24
Q4 Earnings: Tech Sector Back in Growth Mode,7-Feb-24
Q4 Earnings: Tech Sector Back in Growth Mode,7-Feb-24
Magnificent 7 ETFs Rise on Blockbuster Earnings,7-Feb-24
"Noteworthy Wednesday Option Activity: TSLA, PUBM, SPOT",7-Feb-24
3 Stocks to Buy ASAP for a Rate Cut Windfall in 2024,7-Feb-24
Tesla Sells Only 1 EV During January In South Korea,7-Feb-24
3 Mega-Trend Stocks to Boost Your Portfolio by 2028,7-Feb-24
More Bad News for Tesla Stock: Ford and Toyota Are Thriving,7-Feb-24
Cathie Wood Goes Bargain Hunting: 3 Stocks She Just Bought,7-Feb-24
Vanguard Mega Cap Growth ETF Experiences Big Inflow,7-Feb-24
"Tesla asks which jobs are critical, stoking layoff fears- Bloomberg",7-Feb-24
"Pre-Market Most Active for Feb 7, 2024 :  GLT, BABA, NYCB, SNAP, SQQQ, MOR, GRDI, PLTR, RBLX, TQQQ, TSLA, TSLL",7-Feb-24
"Tesla: Buy, Sell, or Hold?",7-Feb-24
TSLA Factor-Based Stock Analysis,7-Feb-24
Tesla Announces Another Artificial Intelligence (AI) Supercomputer. Here Are the Real Winners.,7-Feb-24
3 EV Stocks on the Fast Track to Double in 2024,7-Feb-24
Where Will Tesla's Stock Be in 10 Years?,7-Feb-24
"Tesla's German plant produced 6,000 cars in a week -Tagesspiegel",6-Feb-24
"Move Over, Tesla: 5 Stocks That Could Take Its Place in the Magnificent Seven",6-Feb-24
3 EV Stocks With Serious Potential to Make You a Millionaire,6-Feb-24
Tuesday's ETF with Unusual Volume: SPGM,6-Feb-24
"SpaceX probed by California over sex bias, retaliation claims",6-Feb-24
UAW says majority of workers at VW Tennessee plant seek to join union,6-Feb-24
Where Will Tesla Stock Be in 2026?,6-Feb-24
Markets Today:  Stocks Fluctuate After Mixed Earnings Results,6-Feb-24
Markets Today:  Stocks Mixed on Mixed Earnings Results,6-Feb-24
"Pre-Market Most Active for Feb 6, 2024 :  PLTR, NIO, SQQQ, NVDA, TSLA, BKR, AAPL, TQQQ, BABA, T, XPEV, WFC",6-Feb-24
TSLA Quantitative Stock Analysis,6-Feb-24
"TSLA Stock Analysis: Tesla’s Long-Term Future Is Still Bright, but Today’s Timing Is Not Right",6-Feb-24
"The Zacks Analyst Blog Highlights NIO, XPeng, LI Auto, Canoo and Tesla",6-Feb-24
Chewing Over the Latest Updates From Microsoft and Alphabet,5-Feb-24
Stocks Finish Lower as Rate Cut Hopes Recede on Hawkish Fed,5-Feb-24
"US STOCKS-Wall Street equities fall with interest rates, earnings in focus",5-Feb-24
NIO Stock Analysis: A High-Octane Gamble or Smart Speculative Play?,5-Feb-24
Why Tesla Stock Tanked in January,5-Feb-24
"Wall Street falls with interest rates, earnings in focus",5-Feb-24
"US STOCKS-Wall Street falls with interest rates, earnings in focus",5-Feb-24
This Is How Elon Musk Got Rich,5-Feb-24
Viral videos of Tesla drivers using VR headsets prompt US government alarm,5-Feb-24
Why Tesla Stock Tanked Monday,5-Feb-24
Can All of the Magnificent Seven Stocks Maintain their Dominance This Year?,5-Feb-24
Ford Motor Q4 Preview: Is F Stock a Good Value Buy Ahead of Earnings?,5-Feb-24
"Tesla falls after report of SAP snub, Piper Sandler price target cut",5-Feb-24
Wall St falls as Treasury yields ascend; earnings in focus,5-Feb-24
7 Sustainable Stocks for Eco-Conscious Investors in 2024,5-Feb-24
US STOCKS-Wall Street drops as Treasury yields ascend; earnings in focus,5-Feb-24
Why Tesla’s Not-So-Magnificent Start to 2024 May Be an Opportunity,5-Feb-24
Tesla Stock Investors Can't Catch a Break in 2024,5-Feb-24
US STOCKS-Wall St set for lower open as Treasury yields climb; earnings in focus,5-Feb-24
"EV Roundup: LI's 106% Y/Y Delivery Growth, TSLA's 2.2M Vehicle Recall & More",5-Feb-24
"Auto Roundup: GM Tops Q4 Earnings Estimates, LAD Buys Pendragon & More",5-Feb-24
US STOCKS-Futures dip as Powell drives Treasury yields higher; earnings in focus,5-Feb-24
"Microsoft, Meta Platforms, Amazon, Apple, Alphabet, Tesla and Nvidia are part of Zacks Earnings Preview",5-Feb-24
Will AMD Be Worth More Than Tesla by 2025?,5-Feb-24
"1 ""Magnificent Seven"" Stock to Buy Hand Over Fist in February, and 1 to Avoid Like the Plague",5-Feb-24
The Average Individual Stock Investor Owns This 1 Stock. Do You?,5-Feb-24
ANALYSIS-Toyota to outshine rivals as more consumers opt for hybrids amid EV slowdown,4-Feb-24
Massive News for Tesla Stock Investors,4-Feb-24
Guru Fundamental Report for TSLA,4-Feb-24
"Microsoft, Tesla, Netflix, and More: Big Names in the Market Worth Talking About",3-Feb-24
What to Make of the Latest Tesla Report and Elon Musk's Comments,3-Feb-24
"1 Unstoppable Growth ETF to Turn $100 Per Month Into $518,000 While Barely Lifting a Finger",3-Feb-24
"Prediction: Bitcoin Will Reach $100,000 in 2025",3-Feb-24
Magnificent 7 Earnings Results Solidify Market Leadership,2-Feb-24
Spotify signs new deal with popular US podcaster Joe Rogan,2-Feb-24
Elon Musk's Tesla Recalls Around 2.2 Mln EVs Over Warning Lights Issue,2-Feb-24
"US STOCKS-Nasdaq, S&P 500 climb on tech earnings cheer; strong jobs data weighs",2-Feb-24
Farmers block Dutch-Belgian border as anger spreads across Europe,2-Feb-24
3 Stocks to Buy for the Next Big Wave in Green Transportation,2-Feb-24
These 10 Incredible Stocks Have Grown Revenue Over 25% for a Decade,2-Feb-24
"After Earnings, What's Next for the Magnificent Seven?",2-Feb-24
US STOCKS-Nasdaq eyes higher open on tech earnings cheer; strong jobs data weighs,2-Feb-24
"Pre-Market Most Active for Feb 2, 2024 :  SQQQ, AMZN, META, TQQQ, AAPL, TSLA, NIO, BMY, CCL, XOM, PLTR, NYCB",2-Feb-24
Validea Detailed Fundamental Analysis - TSLA,2-Feb-24
Nasdaq futures advance on tech earnings cheer; jobs data on tap,2-Feb-24
US STOCKS-Nasdaq futures jump on tech earnings cheer ahead of jobs data,2-Feb-24
ANALYSIS-Tesla activist investors to seize on Elon Musk pay ruling,2-Feb-24
Tesla to recall over 2 mln vehicles in US - NHTSA,2-Feb-24
Tesla to recall nearly all its US vehicles in largest-ever recall,2-Feb-24
"3 ""Magnificent Seven"" Stocks With 45% to 84% Upside in 2024, According to Certain Wall Street Analysts",2-Feb-24
Nvidia sets monthly record with unprecedented market value surge in January,2-Feb-24
Panasonic's battery unit maintains annual profit forecast at $785 mln,2-Feb-24
ANALYSIS-Volvo's Polestar troubles signal 'shakeout time' for EV industry,2-Feb-24
Tesla opens first South America store in Chilean capital,1-Feb-24
New Stock Warning: 3 Reasons NOT to Buy the Amer Sports IPO,1-Feb-24
ANALYSIS-Shifting Tesla incorporation to Texas may not give Musk what he wants,1-Feb-24
Musk's Tesla To Hold Shareholder Vote On Moving Incorporation To Texas,1-Feb-24
Magnificent Seven Earnings Contributions Can’t Be Denied,1-Feb-24
"Zacks Earnings Trends Highlights: Microsoft, Alphabet, Tesla, Amazon, Meta and Apple",1-Feb-24
"Pre-Market Most Active for Feb 1, 2024 :  SQQQ, TQQQ, NIO, PFE, T, AAPL, PINS, SOFI, TSLA, MNST, NYCB, CCL",1-Feb-24
Guru Fundamental Report for TSLA,1-Feb-24
Futures climb following Wall St selloff after Fed holds rates steady,1-Feb-24
Why Lucid's Days May Be Numbered,1-Feb-24
