title,date
Best Artificial Intelligence Stock to Buy: C3.ai vs. Tesla,19-Jun-23
3 Stocks to Avoid This Week,19-Jun-23
"EV Roundup: TSLA's NACS Wave, NKLA's Cost Optimization Drive & More",19-Jun-23
Here's Why You Should Take Warren Buffett's Advice on EV Stocks,19-Jun-23
FOCUS-Chile's Codelco must kick-start lithium industry while reviving copper output,19-Jun-23
"Calpers' Stock Purchases Show Some Confidence in U.S., Global Economies",19-Jun-23
Top EV ETFs for Electrifying Gains as Charging Network Expands,18-Jun-23
Guru Fundamental Report for TSLA,18-Jun-23
Want to Get Richer? 5 Top Stocks to Buy Now and Hold Forever,18-Jun-23
Better EV Stock: NIO vs. ChargePoint,18-Jun-23
Get In Early On These Next 3 Trillion-Dollar Companies,17-Jun-23
Elon Musk Talks About 2 of the Biggest Risks to Civilization. But He's Betting Big on 1 of Them.,17-Jun-23
Why Renewable Energy Stocks Popped This Week,16-Jun-23
Musk expects brain chip start-up Neuralink to implant 'first case' this year,16-Jun-23
Friday's ETF with Unusual Volume: IWL,16-Jun-23
Validea Detailed Fundamental Analysis - TSLA,16-Jun-23
Musk: Tesla's value is based primarily on vehicle autonomy,16-Jun-23
"Nasdaq 100 Movers: AMD, RIVN",16-Jun-23
3 Top Stocks to Buy and Hold for the Next Decade,16-Jun-23
Electric-vehicle startups set to extend blistering rally,16-Jun-23
3 Electrifying EV Stocks to Buy for the Road to Riches,16-Jun-23
"Pre-Market Most Active for Jun 16, 2023 :  SPCE, SQQQ, TQQQ, SOFI, NIO, TSLA, PLTR, VECT, QQQ, SNAP, CCL, NETI",16-Jun-23
Get Out Now! 3 EV Stocks That Are Poised to Plunge,16-Jun-23
ANALYSIS-Tesla's China expansion hits speed bump amid industry overcapacity,16-Jun-23
ANALYSIS-Biden's IRA climate bill won't cut deficit as expected,16-Jun-23
"VinFast posts deeper loss in Q1, eyes July completion of SPAC merger",16-Jun-23
ANALYSIS-Tesla's China expansion hits speed bump amid industry overcapacity,15-Jun-23
"China's Xpeng expands self-driving capability to Beijing, eyes wider expansion",15-Jun-23
Top 7 Long-Term Investment Stocks for Future Millionaires,15-Jun-23
US senators urge regulator to change guidance on Massachusetts auto law,15-Jun-23
US senators urge federal agency to reconsider automaker guidance on vehicle law,15-Jun-23
The 7 Best Meme Stocks to Buy Now,15-Jun-23
"Ford, GM see strong US consumer demand for vehicles",15-Jun-23
3 EV Battery Companies With Massive Potential,15-Jun-23
Thursday's ETF with Unusual Volume: FEX,15-Jun-23
Have You Missed the 2023 Stock Rally?,15-Jun-23
"Ford CFO sees supply disruptions easing, retail prices softening",15-Jun-23
Single-Stock Tesla ETF Racing to Hit Billion-Dollar AUM,15-Jun-23
Japan to give Toyota $854 mln support for domestic EV battery output-Nikkei,15-Jun-23
Toyota's (TM) Green Revolution: Time to Bet on This EV Underdog?,15-Jun-23
Is Tesla Stock Headed Back to a Trillion-Dollar Market Cap?,15-Jun-23
Tech Titans Propel QQQ: Is A Pullback Looming?,15-Jun-23
Wall Street set to fall at open as Fed foresees further rate hikes,15-Jun-23
5 Electrifying EV Stocks to Buy for the Road to Riches,15-Jun-23
Future Mobility ETFs: Under the Hood,15-Jun-23
Guru Fundamental Report for TSLA,15-Jun-23
US STOCKS-Futures falter as Fed forecasts further rate hikes,15-Jun-23
"Toyota Rallies On Shareholder Votes, Cheap Sustainable Value",15-Jun-23
Hot Play or Overheated? Tesla’s 13-Day Win Streak Finally Ends,15-Jun-23
3 Safe EV Stocks to Buy for Long-Term Gains,15-Jun-23
2 Unexpected Auto Deals Are Giving Tesla Stock a Shiny New Glow,15-Jun-23
The Most Successful Hedge Fund Manager in History Is Selling Tesla Stock and Buying This Nasdaq Index Fund,15-Jun-23
How to Retire Rich: Growth Stocks Edition,15-Jun-23
US STOCKS-Futures fall as Fed signals more rate hikes,15-Jun-23
"If I Had $1,000 to Invest Between Amazon, Johnson & Johnson, and Tesla Stocks, Here's How I'd Do It",15-Jun-23
"3 Stock-Split Stocks With 52% to 701% Upside, According to Wall Street",15-Jun-23
French power company Engie launches new electric car charger brand,15-Jun-23
Tesla (TSLA) Stock Sinks As Market Gains: What You Should Know,14-Jun-23
Tesla shares finally snap record 13-day win streak that added $200 bln in value,14-Jun-23
3 (Almost) Trillion-Dollar Tech Giants That Still Have Room to Run,14-Jun-23
Why Now’s The Time for a Clean Energy ETF,14-Jun-23
"Notable Wednesday Option Activity: TSLA, FDX, CVS",14-Jun-23
GM or TSLA: Which Is the Better Value Stock Right Now?,14-Jun-23
"Notable ETF Inflow Detected - IWF, TSLA, UNH, PG",14-Jun-23
EXCLUSIVE-Bill Gates in China to meet President Xi on Friday - sources,14-Jun-23
EXCLUSIVE-Bill Gates in China to meet President Xi on Friday - sources,14-Jun-23
EV Charging Space in for a Paradigm Shift With Tesla's NACS,14-Jun-23
Favorable Government Subsidies Continue to Fuel Tesla's Penetration into the Electric Vehicle Market,14-Jun-23
"Stock Market News for Jun 14, 2023",14-Jun-23
France wants Tesla to build gigafactory in country - CNBC,14-Jun-23
This EV Stock Is Lifting Its Entire Nation's Stock Market,14-Jun-23
Could Canoo Really Become the Next Tesla?,14-Jun-23
"US STOCKS-S&P 500, Nasdaq eye higher open in run-up to Fed rate verdict",14-Jun-23
"Pre-Market Most Active for Jun 14, 2023 :  TSLA, LITE, TQQQ, LI, SQQQ, SOFI, CCL, NIO, PLTR, LUMN, AI, VVV",14-Jun-23
TSLA Factor-Based Stock Analysis,14-Jun-23
Opinion: These Will Be the 4 Largest Stocks by 2035,14-Jun-23
"US STOCKS-S&P 500, Nasdaq futures rise in run-up to Fed rate verdict",14-Jun-23
"The Best Stocks to Invest $50,000 in Right Now",14-Jun-23
3 Bargain Investments That Cathie Wood Loves,14-Jun-23
3 Promising EV Stocks to Get Ahead of the Game,14-Jun-23
Your Guide to All 6 Cathie Wood ETFs,14-Jun-23
Cathie Wood Thinks This Stock Is the Biggest AI Play in the Market,14-Jun-23
3 Growth Stocks for the Next 10 Years and Beyond,14-Jun-23
3 Industry-Leading AI Stocks Outside the Tech Sector That Are on the Cutting Edge of Innovation,14-Jun-23
EXPLAINER-Why are other automakers chasing Tesla's 'Gigacasting'?,14-Jun-23
"Toyota makes its case at AGM after investors question strategy, governance",13-Jun-23
Toyota shareholders set to vote on climate lobbying as EV pivot in focus,13-Jun-23
Tesla raises US price of Model Y,13-Jun-23
"At Toyota annual meeting, ambitious pivot may overshadow shareholder challenge",13-Jun-23
US STOCKS-US stocks end higher as inflation data cements bets on rate hike pause,13-Jun-23
US tells automakers not to comply with Massachusetts vehicle data law,13-Jun-23
3 Surprising EV Stocks Surging on Tesla’s Supercharger News,13-Jun-23
Stellantis says it is evaluating Tesla's charging standard,13-Jun-23
US STOCKS-U.S. stocks rally as inflation data cements bets on rate hike pause,13-Jun-23
"Larry Ellison Surpasses Bill Gates' Wealth, Thanks to Oracle Cloud Market Share Gains",13-Jun-23
Time to Sell Tesla? Inverse ETFs to Earn Profits,13-Jun-23
"NIO Slashes Prices of All Models, Ends Free Battery Swapping",13-Jun-23
3 Hot Stocks That Can Double Again in 2023,13-Jun-23
"US STOCKS-S&P 500, Nasdaq hit fresh 1-yr highs as inflation data boosts rate pause hopes",13-Jun-23
"EV Roundup: GM-TSLA Charging Deal, BWA's ""Charging Forward: 2027"" & More",13-Jun-23
US STOCKS-Wall St eyes higher open as inflation data boosts rate pause hopes,13-Jun-23
How to Retire Rich: EV Stocks Edition,13-Jun-23
"Pre-Market Most Active for Jun 13, 2023 :  TQQQ, SQQQ, CDZI, SOFI, TSLA, NIO, PLTR, CCL, MANU, QQQ, ORCL, ACRO",13-Jun-23
Guru Fundamental Report for TSLA,13-Jun-23
GLOBAL MARKETS-Shares get a tech boost; dollar dithers ahead of inflation data,13-Jun-23
"US STOCKS-Futures rise ahead of inflation reading, Fed meet in focus",13-Jun-23
Tesla Stock: Headed to $300?,13-Jun-23
Tesla Stock: 1 Analyst Bets Shares Soar to $335,13-Jun-23
ANALYSIS-Tesla taps brakes on job ads after Musk clamps down on hiring,13-Jun-23
"Wall Street futures rise ahead of inflation reading, Fed meet in focus",13-Jun-23
"1 Stock-Split Stock Set to Join Apple, Microsoft, Amazon, and Alphabet in the $1 Trillion Club",13-Jun-23
2 Stocks I'm Never Selling,13-Jun-23
GLOBAL MARKETS-Shares get a boost from tech; dollar dithers ahead of inflation data,13-Jun-23
"GLOBAL MARKETS-Asia shares track Wall Street rally with US inflation data, Fed in focus",13-Jun-23
"Toyota unveils plans for new battery tech, EV innovation",12-Jun-23
"GLOBAL MARKETS-Asia shares track Wall Street rally with inflation data, Fed in focus",12-Jun-23
Toyota to market next-gen battery EVs from 2026 built by new EV unit,12-Jun-23
Why Blink Charging Stock Crushed the Market on Monday,12-Jun-23
Why Rivian Stock Crawled Only Marginally Higher Today,12-Jun-23
ANALYSIS-EV charger makers guardedly look to adopt Tesla standard,12-Jun-23
Tesla's Surge Boosts EV ETFs,12-Jun-23
Equal-Weight Tech ETF DTEC Hits Buy Signal,12-Jun-23
US STOCKS-S&P 500 and Nasdaq close at highest since April 2022,12-Jun-23
US STOCKS-U.S. stocks extend rally; investors bet Fed will pause rate hikes,12-Jun-23
Why Li Auto May Be the True Contender in China’s EV Market,12-Jun-23
7 EV Sleeper Stocks to Buy Before Investors Wake Up,12-Jun-23
ANALYSIS-EV charger makers guardedly look to adopt Tesla standard,12-Jun-23
Why Nio Stock Shot Higher Today,12-Jun-23
Indian small-cap Urja Global jumps on Tesla-deal confusion,12-Jun-23
Tesla (TSLA) Stock In Overdrive After GM Charging Deal,12-Jun-23
GM-TSLA Pact Jolts EV Charging Stocks: An Overblown Reaction?,12-Jun-23
"Stock Market News for Jun 12, 2023",12-Jun-23
"Investors Heavily Search Tesla, Inc. (TSLA): Here is What You Need to Know",12-Jun-23
Mobileye: A Recent IPO With High Growth (And Squeeze) Potential,12-Jun-23
Blink to launch fast charger for EVs with Tesla's charging port,12-Jun-23
"Pre-Market Most Active for Jun 12, 2023 :  NIO, KDNY, TSLA, CCL, TQQQ, SQQQ, PLTR, AMD, TSLL, CVNA, XPEV, NVS",12-Jun-23
Validea Detailed Fundamental Analysis - TSLA,12-Jun-23
"Apple, Amazon, Alphabet, Microsoft, Meta, Nvidia & Tesla are part of Zacks Earnings Preview",12-Jun-23
EV Charging Solutions: GM's Move Reflects Industry Challenges,12-Jun-23
Could NIO Be the Underappreciated EV Stock of 2023?,12-Jun-23
Why Li Auto Stock May Be Sitting in the Hybrid Sweet Spot,12-Jun-23
"In the Market: For firms, China policy semantics are not the point",12-Jun-23
"In the Market: For firms, China policy semantics are not the point",12-Jun-23
Is Nio Stock a Buy Now?,11-Jun-23
Guru Fundamental Report for TSLA,11-Jun-23
Is It Finally Time to Dump Dogecoin?,11-Jun-23
"WALL ST WEEK AHEAD-Investors rethink recession plays, boosting U.S. stock market laggards",11-Jun-23
3 Stocks to Avoid This Week,11-Jun-23
3 Stocks to Buy to Play Europe’s EV Battery Boom,11-Jun-23
Driving Revolution: Uber and Waymo Join Forces,11-Jun-23
Tesla Stock: Headed to $300?,10-Jun-23
Tesla Stock Is on a Historic Run. Will It Continue?,10-Jun-23
Guru Fundamental Report for TSLA,10-Jun-23
Author Ashlee Vance Helps Separate Real From Hype in the Space Industry,10-Jun-23
"Twitter to pay verified creators for ads in replies, Musk says",9-Jun-23
"WALL ST WEEK AHEAD-Investors rethink recession plays, boosting U.S. stock market laggards",9-Jun-23
GLOBAL MARKETS-World shares at 13-month peak as Wall St scales 2023 highs,9-Jun-23
Tesla’s SuperCharger Deals Make EVgo Stock (NASDAQ:EVGO) a No-Go,9-Jun-23
How Some EV Makers Are Staying on the Road,9-Jun-23
US STOCKS-S&P 500 ends slightly higher as Tesla rallies,9-Jun-23
This Week in ETFs: Barclays Redeems 21 iPath ETNs,9-Jun-23
Tesla Stock (NASDAQ:TSLA): Don’t Stand in Front of This Moving Train,9-Jun-23
Breaking Down The Big 7 Tech Players' Outsized Roles,9-Jun-23
"Friday Sector Leaders: Technology & Communications, Consumer Products",9-Jun-23
"Technology Sector Update for 06/09/2023: TSLA, ADBE, KC",9-Jun-23
"Top Analyst Reports for Coca-Cola, Petrbras & Shopify",9-Jun-23
GLOBAL MARKETS-World shares steady as Fed pause bets bolster sentiment,9-Jun-23
"US STOCKS-S&P 500, Nasdaq hit fresh 2023 highs as Tesla rallies",9-Jun-23
IPOs Quietly Leads this Market: 3 Top-Ranked Stocks to Consider,9-Jun-23
White House says Tesla chargers available for federal dollars as long as they include CCS,9-Jun-23
White House says Tesla chargers available for federal dollars as long as they include CCS,9-Jun-23
General Motors (GM) to Integrate Tesla's NACS Plugs Into EVs,9-Jun-23
"Nasdaq 100 Movers: PYPL, ADBE",9-Jun-23
Why Tesla Stock Jumped on Friday,9-Jun-23
"US STOCKS-S&P, Nasdaq hit fresh 2023 highs as Tesla rallies",9-Jun-23
"S&P 500 Movers: DISH, ADBE",9-Jun-23
Tesla (TSLA) Just Won the Charger Wars: What Does that Mean for Investors?,9-Jun-23
S&P 500 ETF Enters Bull Market: 5 Best Stocks YTD,9-Jun-23
U.S. Stock Futures Mixed to Close an Eventful Week,9-Jun-23
GM Joins the Tesla Bandwagon,9-Jun-23
Musk Tops the Rich List as Tesla (TSLA) Hits 2023 High,9-Jun-23
"US STOCKS-Nasdaq eyes higher open on Tesla boost, Fed meet in focus",9-Jun-23
Tesla jumps as GM deal takes Supercharger network closer to US standard,9-Jun-23
Validea Detailed Fundamental Analysis - TSLA,9-Jun-23
3 EV Stocks You Need To Have On Your Watchlist,9-Jun-23
Don’t Rule Out a Rally in These 3 EV Stocks,9-Jun-23
3 Mid Caps You Haven't Heard Of But Need To Know About,9-Jun-23
"Futures dip after Wall Street rally, focus on Fed",9-Jun-23
7 Great Dividend Stocks Under $25 for 2023,9-Jun-23
Elon Musk Just Issued a Stark Warning to Nvidia,9-Jun-23
The 3 Most Promising Energy Storage Stocks for June 2023,9-Jun-23
Is ChargePoint a Screaming Buy After Ford-Tesla Charging Deal? Not So Fast,9-Jun-23
Carmaker Toyota to invest $328 mln in Mexico hybrid pickup plant,8-Jun-23
3 Auto Stocks to Buy in June,8-Jun-23
The 3 Most Promising Battery Stocks to Buy in June,8-Jun-23
Auto Stocks get Upgraded: 3 Top-Ranked Stocks to Buy Now,8-Jun-23
US STOCKS-Wall Street ends up amid record low volatility ahead of eventful week,8-Jun-23
GM CEO to discuss future of EV charging with Musk on Twitter,8-Jun-23
US STOCKS-Wall Street ends up amid record low volatility ahead of eventful week,8-Jun-23
Apple Stock is on Fire. Invest in it with These 3 ETFs,8-Jun-23
US STOCKS-Wall Street climbs amid thin volumes ahead of eventful week,8-Jun-23
"Technology Sector Update for 06/08/2023: GOOG, TSLA, EGIO",8-Jun-23
California DMV conditionally approves Mercedes-Benz's automated driving tech,8-Jun-23
US STOCKS-Wall Street climbs as yields slip on jobless claims data,8-Jun-23
The 3 Most Promising EV Stocks to Buy for June 2023,8-Jun-23
Wall Street inches up as yields slip on jobless claims data,8-Jun-23
Guru Fundamental Report for TSLA,8-Jun-23
Prediction: These Will Be 4 of the Most Valuable Stocks by 2040,8-Jun-23
Tesla considering building 4.5 bln euro car factory in Spain - report,8-Jun-23
A Bull Market Is Coming: These 2 Cathie Wood Stocks Could Skyrocket,8-Jun-23
"China passenger car sales rise in May on incentives, new models",8-Jun-23
"EXCLUSIVE-Chinese energy storage, battery firms consider big investments in Vietnam -sources",8-Jun-23
US luxury EV maker Lucid set to enter China market,7-Jun-23
Key US auto safety official resigns to join Zoox,7-Jun-23
What Does Tesla's Deal With Ford Mean for ChargePoint?,7-Jun-23
2 Market Heavyweights Stealing the Spotlight in June,7-Jun-23
"US STOCKS-S&P 500, Nasdaq fall as tech shares give up gains",7-Jun-23
3 Overbought Stocks to Snap Up on Correction,7-Jun-23
"Is Tesla Stock a Buy, Sell or Hold? Here’s My Call.",7-Jun-23
Volvo Cars launches EX30 electric SUV with focus on affordability,7-Jun-23
Validea Detailed Fundamental Analysis - TSLA,7-Jun-23
Volvo Cars launches EX30 electric SUV with focus on affordability,7-Jun-23
Tesla/Ford Partnership Changes EV Charging Forever,7-Jun-23
3 Stocks to Buy for a Billionaire-Backed Portfolio,7-Jun-23
Tesla: How and Why It Gets To $300,7-Jun-23
"Gevo's Cash Flow, Small Cap Buying Back Shares",7-Jun-23
3 Investing Lessons Courtesy of Ted Lasso,7-Jun-23
Tesla (TSLA) Outpaces Stock Market Gains: What You Should Know,6-Jun-23
US EPA to remove proposed EV volumes from biofuel blending rule - sources,6-Jun-23
Vanguard Total Stock Market ETF Experiences Big Inflow,6-Jun-23
Court upholds Musk's win in $13 bln lawsuit over Tesla-SolarCity deal,6-Jun-23
QuantumScape: The ‘Forever Battery’ Stock With Millionaire-Maker Potential,6-Jun-23
ANALYSIS-Can Biden's compromise strategy fix a divided US?,6-Jun-23
This Billionaire Just Sold Out of Tesla Stock. Should You Follow?,6-Jun-23
Tesla's Model 3 cheaper than Toyota's Camry in California with tax benefits,6-Jun-23
New Investor? Follow in the Footsteps of These 3 Trailblazing Female Investors.,6-Jun-23
3 Battery Stocks That Could Skyrocket in the Next 12 Months,6-Jun-23
Will the Rubber Meet the Road for Mullen Stock?,6-Jun-23
ANALYSIS-Ford's EV charging tie-up with Tesla ripples through industry,6-Jun-23
"Company News for Jun 6, 2023",6-Jun-23
ANALYSIS-Can Biden's compromise strategy fix a divided US?,5-Jun-23
Panasonic to boost battery output at Tesla's Nevada Gigafactory - Nikkei,5-Jun-23
Elon Musk says China will initiate AI regulations,5-Jun-23
US STOCKS-S&P 500 ends lower as traders eye potential pause in rate hikes,5-Jun-23
US STOCKS-S&P 500 ends lower as traders eye potential pause in rate hikes,5-Jun-23
US STOCKS-U.S. stocks mixed as traders eye potential pause in rate hikes,5-Jun-23
ANALYSIS-Can Biden's handshake to a gunfight strategy fix what ails the US?,5-Jun-23
Elon Musk says 'happy' to license Tesla self-driving technology,5-Jun-23
3 EV Stocks Positioned to Thrive in an Uncertain Economy,5-Jun-23
Buffett-Backed BYD Caught In The Chinese Government's Stimulus,5-Jun-23
2 Artificial Intelligence (AI) Growth Stocks Make Up 14% of Cathie Wood's Portfolio,5-Jun-23
"Nasdaq 100 Movers: ABNB, PANW",5-Jun-23
Jamie Dimon Says Fed Should Pause Rate Hikes: History Says the Stock Market Will Do This Next,5-Jun-23
"Tesla May Have Just Unlocked a New, Profitable Revenue Stream",5-Jun-23
Validea Detailed Fundamental Analysis - TSLA,5-Jun-23
A New Bull Market Has Arrived,5-Jun-23
Intel Stock: Recent Hits and Misses in Its Foundry Business,5-Jun-23
Tesla's China-made EV sales rose 2.4% in May from April - CPCA,5-Jun-23
Tesla's China-made EV sales rose 2.4% in May from April - CPCA,5-Jun-23
INSIGHT-France rolls out the red carpet for EV battery factories,5-Jun-23
"Why Tesla and Rivian Soared, but Nikola Plunged, in May",4-Jun-23
Guru Fundamental Report for TSLA,4-Jun-23
Tesla Investors Can Slowly Get More Excited About This,3-Jun-23
Rule Breaker Investor Habit No. 6: Aim for 60% Accuracy,3-Jun-23
Guru Fundamental Report for TSLA,3-Jun-23
"Microsoft, Tesla, and Amazon Are Among 110 S&P 500 Companies Discussing AI -- 2 Other AI Stocks to Buy Hand Over Fist",3-Jun-23
Wall St Week Ahead-Surging US megacap stocks leave some wondering when to cash out,2-Jun-23
"EXCLUSIVE-Stellantis, GM pay $363 million in US fuel economy penalties",2-Jun-23
"EXCLUSIVE-Stellantis, GM pay $363 million in US fuel economy penalties",2-Jun-23
Validea Detailed Fundamental Analysis - TSLA,2-Jun-23
"GM, POSCO Future M to boost investment at Canada battery materials plant",2-Jun-23
US STOCKS-Futures rise ahead of May jobs data; debt default averted,2-Jun-23
"GM, Posco Future to expand EV battery supply chain",2-Jun-23
Tech shares see biggest ever weekly inflow on AI boom-BofA,2-Jun-23
3 Cathie Wood Stocks That Could Deliver Bigger Gains Than the Market,2-Jun-23
"Of All These Chip Stocks, This One Could Benefit the Most From the AI Boom",2-Jun-23
The Future of Logistics: How AI Is Changing the Transportation Industry,2-Jun-23
"Zacks Investment Ideas feature highlights: Tesla, Apple, General Motors, Honda Motor and Ford",2-Jun-23
RIVN vs. TSLA: Which EV Stock is a Better Ride?,1-Jun-23
"Financial Sector Update for 06/01/2023: TSLA, JPM, BAM, TIO",1-Jun-23
Elon Musk is accused of insider trading by investors in Dogecoin lawsuit,1-Jun-23
Why Is Ford Motor Company (F) Up 1.8% Since Last Earnings Report?,1-Jun-23
Elon Musk is accused of insider trading by investors in Dogecoin lawsuit,1-Jun-23
LVMH chief Bernard Arnault to visit China in June -sources,1-Jun-23
Cathie Wood Says Software Is the Next Big AI Buying Opportunity -- And These 4 Stocks Could Skyrocket,1-Jun-23
5 Reasons to Buy Tesla Now,1-Jun-23
GRAPHIC-Nvidia runaway winner in market cap addition in May,1-Jun-23
Guru Fundamental Report for TSLA,1-Jun-23
Tesla Reaches Analyst Target Price,1-Jun-23
Beyond Tesla: This AI-Driven EV Stock Could Outperform the Competition,1-Jun-23
Is Li Auto Stock China’s Ticket to Global EV Domination?,1-Jun-23
Should You Invest in the Vanguard Consumer Discretionary ETF (VCR)?,1-Jun-23
Elon Musk met with Chinese Vice Premier Ding in Beijing -source,1-Jun-23
"Time to Buy These ""Trillion Dollar"" Stocks for More Upside",1-Jun-23
Elon Musk's jet takes off from Shanghai for Austin - flight tracking data,31-May-23
Elon Musk's private jet scheduled to leave China on Thursday -flight tracking data,31-May-23
Tesla doubles discounts on Model 3 cars in US inventory,31-May-23
Mexico telecoms sector says broader 5G coverage needed to attract top companies,31-May-23
Tesla (TSLA) Gains As Market Dips: What You Should Know,31-May-23
Ford CEO says EV cost parity may not come until after 2030,31-May-23
Prediction: These Stock-Split Stocks Will Lead Gains in the Next Bull Market,31-May-23
Nvidia rally: Retail investors stay out on growing slowdown worries,31-May-23
Ford CEO says EV cost parity may not come until after 2030,31-May-23
Elon Musk scheduled to visit Tesla's Shanghai plant on Weds night - sources,31-May-23
"Company News for May 31, 2023",31-May-23
Tesla Is Doing Something It Has Never Done Before,31-May-23
"Pre-Market Most Active for May 31, 2023 :  AI, SQQQ, TQQQ, PLTR, SOFI, TSLA, NVDA, AAL, NIO, TAL, BBAI, AAP",31-May-23
Validea Detailed Fundamental Analysis - TSLA,31-May-23
Is Nuveen ESG Large-Cap Growth ETF (NULG) a Strong ETF Right Now?,31-May-23
"British consortium to invest $9 bln in Indonesia mining, EV batteries, minister says",31-May-23
"The Zacks Analyst Blog Highlights Tesla, TotalEnergies, Intuitive Surgical, Charles Schwab and Monster Beverage",31-May-23
Elon Musk visits China's commerce and industry ministries,31-May-23
"Private astronaut crew, including first Arab woman in orbit, returns from space station",30-May-23
"Unusual Put Option Trade in Tesla (TSLA)  Worth $48,921.60K",30-May-23
Elon Musk visits China's commerce ministry,30-May-23
"Private astronaut crew, including first Arab woman in orbit, heads for splashdown",30-May-23
"For the First Time Ever, Single-Stock ETFs Soon Will Close",30-May-23
Fidelity marks down value of Twitter stake again,30-May-23
"Top Research Reports for Tesla, TotalEnergies & Intuitive Surgical",30-May-23
"US STOCKS-Shares mixed, Nvidia surge offsets jitters over debt ceiling vote",30-May-23
Did Cathie Wood’s ARK Innovation ETF (ARKK) Miss the Most Disruptive Innovation of All?,30-May-23
"US STOCKS-Shares mixed, Nvdia surge offset by jitters over debt ceiling vote",30-May-23
"Elon Musk Visits China, Focuses On Tesla's Expansion",30-May-23
"Noteworthy Tuesday Option Activity: ULTA, CRM, TSLA",30-May-23
The 3 Most Undervalued EV Stocks to Buy Before They Drive Higher,30-May-23
Can Tesla's Supercharger Become the Industry Norm? Ford Says Yes,30-May-23
Tesla Breaks Above 200-Day Moving Average - Bullish for TSLA,30-May-23
Ford Deal Supercharges Tesla,30-May-23
Why Tesla Stock Moved Higher Again Today,30-May-23
"Auto Roundup: TSLA & F's Game-Changing Deal, AZO's Quarterly Results & More",30-May-23
"US STOCKS-Nasdaq boosted by Nvidia, tentative debt deal cheer",30-May-23
Why Nvidia and Tesla Keep Sending the Nasdaq Higher,30-May-23
Canadian AI computing startup Tenstorrent and LG partner to build chips,30-May-23
US STOCKS-Wall St set to open higher on tentative debt ceiling deal; Nvidia jumps,30-May-23
"Pre-Market Most Active for May 30, 2023 :  TQQQ, SQQQ, PLTR, TSLA, AI, NVDA, SOFI, AMD, AAIC, F, GOTU, BSX",30-May-23
Guru Fundamental Report for TSLA,30-May-23
US agency closes investigation into Tesla game feature,30-May-23
Elon Musk's Decision to Try Out Advertising for Tesla Could Be Game-Changing,30-May-23
"US STOCKS-Futures rise on tentative debt ceiling deal, Nvidia gains",30-May-23
2 AI Stocks Wall Street Believes Will Have Trillion-Dollar Valuations,30-May-23
110 of the S&P 500 Companies Are Talking About AI -- 2 Stocks to Buy Right Now,30-May-23
"For the First Time in 23 Years, the S&P 500 Is Displaying an Ominous Warning to Wall Street",30-May-23
Elon Musk's private jet has landed in Beijing - Reuters witness,30-May-23
3 Of the Best Ways to Gain Long-Term Exposure to AI,29-May-23
GM vs. TSLA: Which Stock Is the Better Value Option?,29-May-23
Guru Fundamental Report for TSLA,29-May-23
2 Ultra-Popular AI Stocks Billionaire Investors Are Buying Hand Over Fist and 1 They're Selling,29-May-23
7 Undervalued Blue-Chip Stocks to Buy for June 2023,28-May-23
3 Cathie Wood Stocks Expected to Rise 245% to 980% Over the Next Few Years,28-May-23
"3 Reasons Why Tesla Stock Is Worth $1,000",28-May-23
2 Top Growth Stocks to Buy Right Now and Hold for the Long-Term,28-May-23
Could These 3 Stocks Be Worth $1 Trillion by 2030?,27-May-23
Tesla Is Already the Best-Selling Car Worldwide and a Second Might Soon Follow,27-May-23
Did Tesla Just Give Away Its Biggest Competitive Advantage?,27-May-23
Why Tesla Shares Jumped Higher Today,26-May-23
US STOCKS-Wall Street indexes end sharply higher on optimism about debt ceiling,26-May-23
US STOCKS-Wall Street indexes end sharply higher on optimism about debt ceiling,26-May-23
Electrifying Opportunities in EV ETFs as Tesla & Ford Join Forces,26-May-23
