title,date
"The Zacks Analyst Blog Highlights General Motors, Ford, Stellantis, Honda and Tesla",3-Jan-23
Better Chinese EV Stock: Nio vs. Li Auto,3-Jan-23
Tesla Reports Record Fourth-Quarter Deliveries,3-Jan-23
SpaceX Reportedly Raising $750 Mln,3-Jan-23
EXCLUSIVE-Tesla makes China boss highest-profile executive after Musk,3-Jan-23
EXCLUSIVE-Tesla China boss Zhu promoted to global role - company posting,2-Jan-23
South Korea fines Tesla $2.2 mln for exaggerating driving range of EVs,2-Jan-23
EXCLUSIVE-Tesla China boss Zhu promoted to global role - company posting,2-Jan-23
EXCLUSIVE-Tesla China boss Zhu promoted to global role - company posting,2-Jan-23
"Foxconn reinvents itself, and EV supply chains",2-Jan-23
My Top EV Stock to Buy in 2023 (and It's Not Even Close),2-Jan-23
Tesla Q4 Deliveries Up,2-Jan-23
Elon Musk Becomes First Man Ever To Lose $200 Bln,2-Jan-23
Tesla reports record quarterly deliveries but misses estimates,2-Jan-23
Tesla's quarterly deliveries miss estimates,2-Jan-23
"The Tesla Investor Wish List for 2023, According to Wedbush",2-Jan-23
Tesla in pole position in Norway's race to EV goal,2-Jan-23
Where Will Rivian Stock Go in 2023?,2-Jan-23
Our Top 3 EV Stock Predictions for 2023,2-Jan-23
Stock Market Sell-Off: Is Elon Musk Right About Tesla Stock?,2-Jan-23
These 10 Mega-Cap Stocks Flopped in 2022,2-Jan-23
China Dec manufacturing contracts sharply as COVID infections soar,1-Jan-23
Where Does Tesla Stock Go in 2023?,1-Jan-23
Is Time Up for Tesla Stock? Some on Wall Street Think So,31-Dec-22
Chinese manufacturing contracts sharply as COVID infections soar,31-Dec-22
5 Reasons Tesla Stock Is Collapsing,31-Dec-22
China Dec manufacturing contracts sharply as COVID infections soar,30-Dec-22
Tesla (TSLA) Gains As Market Dips: What You Should Know,30-Dec-22
"GRAPHIC-Inflation, recession and earnings among factors to drive U.S. stocks in 2023",30-Dec-22
US STOCKS-Wall St ends 2022 with biggest annual drop since 2008,30-Dec-22
US STOCKS-Wall St ends 2022 with biggest annual drop since 2008,30-Dec-22
Farewell 2022: Another Dismal Week in the Books,30-Dec-22
Buy the Dip on these 7 Most Hated Stocks,30-Dec-22
"GRAPHIC-Inflation, recession and earnings among factors to drive U.S. stocks in 2023",30-Dec-22
Cathie Wood Goes Bargain Hunting: 3 Stocks She Just Bought,30-Dec-22
HOG or TSLA: Which Is the Better Value Stock Right Now?,30-Dec-22
"Nasdaq 100 Movers: MELI, TSLA",30-Dec-22
The Top 7 Stocks to Watch in 2023,30-Dec-22
"Pre-Market Most Active for Dec 30, 2022 :  TQQQ, SQQQ, TSLA, TIGR, FUTU, KALA, SJR, NIO, GOTU, CS, RLX, HLN",30-Dec-22
Looking Back at the Top Auto Stories of 2022,30-Dec-22
Daily Markets: Stocks Close the Book on a Challenging Year,30-Dec-22
Warren Buffett Is Selling His BYD Shares. Should You?,30-Dec-22
Strength Seen in Tesla (TSLA): Can Its 8.1% Jump Turn into More Strength?,30-Dec-22
Do You Really Need a Single-Stock Tesla ETF?,30-Dec-22
"Baidu, Pony.ai start driverless robotaxi tests in Beijing",30-Dec-22
Elon Musk Faces Margin Call on Loan Used to Purchase Twitter,29-Dec-22
Markets Turn Bullish with a Half-Session Left in 2022,29-Dec-22
"After Hours Most Active for Dec 29, 2022 :  ARDX, CTSH, QQQ, TQQQ, TSLA, AMZN, DCP, NRDY, BAX, SNAP, BAC, T",29-Dec-22
"US STOCKS-Wall St ends firmer, growth stocks lead in thin trading",29-Dec-22
"Wall St closes higher, growth stocks lead in thin trading",29-Dec-22
US STOCKS-Wall St gains with tech stocks leading the way,29-Dec-22
NIO Stock (NYSE:NIO): Overly-Bearish Sentiment is Bullish,29-Dec-22
US STOCKS-Wall St gains as jobless claims data eases rate-hike worries,29-Dec-22
"Why Tesla, Rivian, and Lucid Motors Are Rocketing Higher Today",29-Dec-22
Senator wants U.S. to pause implementation of new electric vehicle tax credits,29-Dec-22
U.S. Treasury says consumer leases can qualify for EV tax credits,29-Dec-22
"Nasdaq 100 Movers: ENPH, TSLA",29-Dec-22
"S&P 500 Movers: BA, TSLA",29-Dec-22
US STOCKS-Wall St gains as jobless claims data eases rate worries,29-Dec-22
"Down 72%, Is Tesla Stock a Once-in-a-Decade Buying Opportunity Right Now?",29-Dec-22
"Pre-Market Most Active for Dec 29, 2022 :  TSLA, ARDX, TQQQ, KALA, TSLL, SQQQ, NIO, GOTU, XPEV, TAL, AMC, ITUB",29-Dec-22
"US STOCKS-Futures rise ahead of jobless claims data, Tesla jumps",29-Dec-22
Tesla to Report Q4 Deliveries: What to Expect,29-Dec-22
Falling Lithium Prices a Blessing for EV Makers,29-Dec-22
Why Carvana Motored 3% Higher Today,28-Dec-22
Musk tells Tesla workers not to be 'bothered by stock market craziness',28-Dec-22
Tesla shares record rare jump this month on the way to worst year,28-Dec-22
"US STOCKS-U.S. stocks end lower on mixed economic data, recession fears",28-Dec-22
"US STOCKS-U.S. stocks fall on recession fears, weak oil prices",28-Dec-22
Wednesday's ETF with Unusual Volume: PBUS,28-Dec-22
"US STOCKS-Wall St reverses gains as energy, growth shares drag",28-Dec-22
Hydrogen Fuel Gives Rise to an $11 Trillion Revolution,28-Dec-22
Why Tesla Stock Bounced Back Wednesday,28-Dec-22
"S&P 500 Movers: SEDG, GNRC",28-Dec-22
Manchester United: Abnormal Price Strength in a Weak Market,28-Dec-22
How Tesla Is Falling Behind in Autonomous Driving,28-Dec-22
"US STOCKS-Wall St rises on boost from growth stocks, China reopening",28-Dec-22
Tesla vs. Apple: One Is Cheaper and Grows Faster Than the Other,28-Dec-22
"Stock Market News for Dec 28, 2022",28-Dec-22
US STOCKS-Wall St eyes higher open as investors digest China reopening,28-Dec-22
US STOCKS-Futures edge higher as investors assess China reopening,28-Dec-22
Could Tesla's Stock Fall Below $100?,28-Dec-22
Would Warren Buffett Buy Shares of Tesla in 2023?,28-Dec-22
"GRAPHIC-Inflation, recession and earnings among factors to drive U.S. stocks in 2023",28-Dec-22
Chinese hospitals 'extremely busy' as COVID spreads unchecked,27-Dec-22
South Korean shares drop over 2% on ex-dividend effects,27-Dec-22
Tesla (TSLA) Now -40% in a Month; Case-Shiller In Depth,27-Dec-22
"GLOBAL MARKETS-Wall St stocks fall, bond yields rise as China drops quarantine rule",27-Dec-22
Stocks Close Mixed to Start Last Week of the Year,27-Dec-22
"US STOCKS-S&P 500, Nasdaq close lower, weighed by growth stocks",27-Dec-22
Tesla shares extend losses on demand worries in China,27-Dec-22
"Consumer Sector Update for 12/27/2022: APPH,TSLA,LUV,NIO,DAL,SAVE,ALK",27-Dec-22
"US STOCKS-S&P 500, Nasdaq close lower, weighed by growth stocks",27-Dec-22
"GLOBAL MARKETS-Wall St stocks fall, oil rises as China drops quarantine rule",27-Dec-22
"Consumer Sector Update for 12/27/2022: TSLA, LUV, NIO",27-Dec-22
TSLA vs. RIVN: Which EV Stock is Better?,27-Dec-22
"US STOCKS-Tesla, megacap growth stocks pull Nasdaq lower; Dow rises",27-Dec-22
Tesla shares extend losses on demand worries in China,27-Dec-22
"GLOBAL MARKETS-Wall St stocks fall, oil rises as China drops quarantine rule",27-Dec-22
Why Nio Stock Is Crashing Ahead of 2023,27-Dec-22
Why Tesla Stock Keeps Going Down,27-Dec-22
"EXCLUSIVE-Tesla to run reduced output in Shanghai in January, plan shows",27-Dec-22
Recent Market Updates Are Driving the Bearish Trend for Tesla Stock,27-Dec-22
ANALYSIS-Wood’s ARK slammed by higher interest rates in 2022 along with other growth funds,27-Dec-22
"Nasdaq 100 Movers: TSLA, JD",27-Dec-22
"S&P 500 Movers: TSLA, WYNN",27-Dec-22
"US STOCKS-S&P 500, Nasdaq knocked down by Tesla, megacap stocks",27-Dec-22
5 Sector ETFs That Beat the Market in December,27-Dec-22
"Why Tesla, Nio Stocks Can't Seem to Stop Falling",27-Dec-22
"Star rising in Kremlin, Russia's Medvedev predicts war in West",27-Dec-22
US STOCKS-Wall St set to open higher after China relaxes COVID curbs,27-Dec-22
Caterpillar and Cracker Barrel Old Country Store have been highlighted as Zacks Bull and Bear of the Day,27-Dec-22
"Pre-Market Most Active for Dec 27, 2022 :  APE, TSLA, TQQQ, NIO, SQQQ, AMC, TSLL, QQQ, LCID, XPEV, BABA, PBR",27-Dec-22
"EXCLUSIVE-Tesla to run reduced output in Shanghai in January, plan shows",27-Dec-22
Tesla Stock Hits 28-month Low Amid Post-Twitter Sell-off,27-Dec-22
My Top Beaten-Down EV Stock to Buy and Hold for the Next Decade,27-Dec-22
US STOCKS-Futures climb as China eases COVID curbs,27-Dec-22
Should You Invest in the Fidelity MSCI Consumer Discretionary Index ETF (FDIS)?,27-Dec-22
"FOCUS-Tesla used car price bubble pops, weighs on new car demand",27-Dec-22
"EXCLUSIVE-Tesla to run reduced output in Shanghai in January, plan shows",27-Dec-22
5 Ultra-Popular Stocks I'd Sell Right Now,27-Dec-22
ANALYSIS-Wood’s ARK slammed by higher interest rates in 2022 along with other growth funds,27-Dec-22
"Tesla Stock: Near-Term Uncertainty Merits a Price Target Cut, Says Analyst",26-Dec-22
Electric Vehicles Will Be a Trillion-Dollar Industry. 3 Things Investors Need to Know,26-Dec-22
3 EV Stocks That Could Run Hot as Tesla Falls to 52-Week Low,25-Dec-22
Is It Better to Buy Auto Chip Stock Pure Plays or Legacy Chip Stocks Getting Into Auto Technology?,25-Dec-22
Wall St Week Ahead-Investors look for 'Santa Rally' after grim year in U.S. stocks,25-Dec-22
Microsoft Strikes a Big Deal With the London Stock Exchange,24-Dec-22
Tesla suspends production at Shanghai plant - internal notice,24-Dec-22
Tesla Stock: Bull vs. Bear,24-Dec-22
"Down 64% in 2022, Is Tesla Stock a Buy for 2023?",24-Dec-22
3 Stocks on Santa's Nice List to Buy Before 2023,24-Dec-22
"US STOCKS-Wall Street ends up as investors eye data for rate prospects, energy outperforms",23-Dec-22
I'm Bullish on EV Stocks But This Has Me a Little Worried,23-Dec-22
"US STOCKS-Wall Street gains as investors eye data for rate prospects, energy outperforms",23-Dec-22
Wall St Week Ahead-Investors look for 'Santa Rally' after grim year in U.S. stocks,23-Dec-22
Why Tesla Shares Swung Wildly Friday,23-Dec-22
Elon Musk's vow to hold on to Tesla stock fails to soothe investors,23-Dec-22
"Wall St choppy post inflation data, energy shares jump",23-Dec-22
Elon Musk's vow to hold on to Tesla stock fails to soothe investors,23-Dec-22
The 3 Best Cathie Wood Stocks to Buy Now,23-Dec-22
"QQQ, TSLA, META, PEP: Large Outflows Detected at ETF",23-Dec-22
5 Momentum ETFs to Tap as Market Awaits Santa Claus Rally,23-Dec-22
Tesla: Bull vs. Bear Case,23-Dec-22
"Company News for Dec 23, 2022",23-Dec-22
"Tesla, Inc. (TSLA) is Attracting Investor Attention: Here is What You Should Know",23-Dec-22
"Pre-Market Most Active for Dec 23, 2022 :  TQQQ, TSLA, SQQQ, AMC, AMZN, UBER, BCRX, PCAR, HLN, KR, ORCL, XPEV",23-Dec-22
"TSLA, RIVN, NIO: 3 EV Stocks to Gain in 2023, Says Analyst",23-Dec-22
US STOCKS-Futures steady ahead of November inflation data,23-Dec-22
"GRAPHIC-How 2022 shocked, rocked and rolled global markets",23-Dec-22
Tesla Inc Shares Close the Week 20.5% Lower - Weekly Wrap,22-Dec-22
Elon Musk says he will not sell more Tesla stock for another two years,22-Dec-22
Form Energy to build long-duration battery plant in West Virginia,22-Dec-22
"US STOCKS-Wall Street tumbles on rate, recession worries, bleak chipmaker outlook",22-Dec-22
Thematic ETF Investing Strategies for 2023,22-Dec-22
"US STOCKS-Wall Street tumbles on rate, recession worries, bleak chipmaker outlook",22-Dec-22
"US STOCKS-Wall Street dives amid Fed rate hike worries, chipmaker woes",22-Dec-22
Tesla's Discount Move Suggests a Troubling Short-Term Mindset,22-Dec-22
U.S. safety agency probes two more Tesla crashes involving suspected driver assistance,22-Dec-22
Twitter seeks dismissal of disability bias lawsuit over job cuts,22-Dec-22
U.S. safety agency probing two new Tesla driver assistance crashes,22-Dec-22
"US STOCKS-Nasdaq dives on Fed rate hike worries, rout in chipmakers",22-Dec-22
"GRAPHIC-How 2022 shocked, rocked and rolled global markets",22-Dec-22
"U.S. Senate Finance Committee asks GM, Tesla, Toyota about Chinese supply chain",22-Dec-22
3 Cathie Wood Stocks to Buy and Hold for 10 Years,22-Dec-22
"Pre-Market Most Active for Dec 22, 2022 :  TQQQ, ORIC, SQQQ, TSLA, XPEV, QQQ, KMX, CS, NIO, GOTU, MU, RENN",22-Dec-22
3 Things About Tesla Stock That Smart Investors Know,22-Dec-22
ANALYSIS-Short sellers gain nearly $304 bln after tumble in U.S. stocks,22-Dec-22
"GRAPHIC-How 2022 shocked, rocked and rolled global markets",22-Dec-22
"Mizuho Picks Over Rivian, Tesla Data, Says Buy The Shares But Reset Target Expectations",22-Dec-22
FOCUS-Tesla sends Shanghai boss and aides to jumpstart U.S. output,22-Dec-22
ANALYSIS-Short sellers gain nearly $304 bln after tumble in U.S. stocks,22-Dec-22
"GRAPHIC-How 2022 shocked, rocked and rolled global markets",22-Dec-22
"Tesla offers discount on some car models in U.S., Canada",22-Dec-22
Tesla driver in multi-car crash told police self-driving software malfunctioned,21-Dec-22
Tesla (TSLA) Stock Sinks As Market Gains: What You Should Know,21-Dec-22
FOCUS-Tesla sends Shanghai boss and aides to jumpstart US output,21-Dec-22
The Bagholder’s Guide to Meta Materials (MMTLP) Stock,21-Dec-22
"Tesla Reportedly Plans More Layoffs, Hiring Freeze",21-Dec-22
Delta and Moderna Share Good News,21-Dec-22
Cathie Wood Goes Bargain-Hunting: 3 Stocks She Just Bought,21-Dec-22
"US STOCKS-Wall St gains on strong Nike earnings, easing inflation expectations",21-Dec-22
Why the Smartest Investors Are Still Buying Tesla Stock,21-Dec-22
"Down Almost 30% This Month, Is Tesla Stock a Buy?",21-Dec-22
US STOCKS-Wall Street eyes higher open on strong Nike earnings,21-Dec-22
"Pre-Market Most Active for Dec 21, 2022 :  TQQQ, CSX, ADCT, TSLA, SQQQ, CMCSA, QQQ, DASH, NKE, PLTR, NEM, CCL",21-Dec-22
"If You Invested $10,000 in Tesla Stock at Its IPO, Here's How Much You'd Have Today",21-Dec-22
"YEARENDER-Elon Musk, 'Chief Twit'",21-Dec-22
"Tesla to freeze hiring, lay off employees next quarter - Electrek",21-Dec-22
"US STOCKS-Futures rise as Nike posts strong quarter, consumer confidence data on tap",21-Dec-22
3 Cryptocurrencies to Buy in Any Bear Market,21-Dec-22
Ever Wonder What Drives Tesla's Revenue?,21-Dec-22
"Corporate China struggles with supply snags, demand slump as COVID cases spread",21-Dec-22
Indonesia considers $320 mln in incentives to boost EV sales in 2023,21-Dec-22
Musk says he'll step down as Twitter CEO after finding a replacement,20-Dec-22
Vietnam’s Elon Musk challenger turns heads in 2023,20-Dec-22
Quiet quitting China will start with the Chinese,20-Dec-22
US STOCKS-Wall St closes slightly higher after four-day sell off,20-Dec-22
US STOCKS-S&P 500 closes slightly higher after four-day sell off,20-Dec-22
Investor in Musk's Twitter buyout expects to make up to five times its money,20-Dec-22
"Tuesday Sector Laggards: Consumer Products, Services",20-Dec-22
"US STOCKS-Wall Street up, regains ground after four-day sell off",20-Dec-22
"Tuesday Sector Laggards: Trucking, Vehicle Manufacturers",20-Dec-22
"US STOCKS-Wall St edges higher as energy, financial stocks rise",20-Dec-22
Tesla falls on growing angst over Musk's focus on Twitter,20-Dec-22
"US STOCKS-Energy, financial stocks lift Wall St after BOJ policy surprise",20-Dec-22
Elon Musk actively searching for new Twitter CEO - CNBC,20-Dec-22
"Pre-Market Most Active for Dec 20, 2022 :  TQQQ, SQQQ, TSLA, VRNA, CS, LCID, QQQ, NIO, IAG, XPEV, CCL, PLTR",20-Dec-22
U.S. Treasury will delay EV battery sourcing guidance until March,19-Dec-22
7 Experience Stocks That Could Pop Off in 2023,19-Dec-22
Top 5 CEO Insider Trades this Week - Starring Elon Musk,19-Dec-22
US STOCKS-Wall Street falls fourth straight day as recession worries nag,19-Dec-22
"Consumer Sector Update for 12/19/2022: DBI,MLCO,MDLZ,TSLA",19-Dec-22
Tesla: 5 Reasons the EV Maker can Recharge its Batteries and Win Again,19-Dec-22
Should You Buy Rivian and Lucid Over Tesla?,19-Dec-22
US STOCKS-Wall Street falls as recession worries persist,19-Dec-22
Should You Short Tesla Stock Amid Rising EV Competition?,19-Dec-22
"Consumer Sector Update for 12/19/2022: MLCO,MDLZ,TSLA",19-Dec-22
Why Is Mullen (MULN) Stock Down 10% Today?,19-Dec-22
US STOCKS-Wall Street falls as recession worries persist,19-Dec-22
"Nasdaq 100 Movers: TEAM, MELI",19-Dec-22
"US STOCKS-S&P 500, Nasdaq fall on rate worries, Tesla struggles after early gains",19-Dec-22
"Tesla's Bouncing, but This Nasdaq Stock Tripled Monday Morning",19-Dec-22
U.S. Senator Warren questions Tesla board oversight of Musk purchase of Twitter,19-Dec-22
Tesla may announce $800 mln to $1 bln in Mexico plant in coming days - report,19-Dec-22
"US STOCKS SNAPSHOT-Wall St opens flat, Tesla rises on Musk poll outcome",19-Dec-22
Tesla may announce Mexico plant in coming days - report,19-Dec-22
"Consumer Sector Update for 12/19/2022: MLCO, TSLA, DIS, XLP, XLY",19-Dec-22
US STOCKS-Wall St set for slightly higher open; Tesla rises on Musk poll outcome,19-Dec-22
"Pre-Market Most Active for Dec 19, 2022 :  TQQQ, TSLA, SQQQ, MDGL, GOTU, AJRD, BABA, UNVR, NIO, QQQ, IPHA, CS",19-Dec-22
German prosecutors open probe into Tesla hazardous materials storage site,19-Dec-22
"US STOCKS-Futures higher after two-week selloff, Tesla jumps on Musk poll",19-Dec-22
Musk poll shows 57.5% want him to step down as Twitter chief,19-Dec-22
Is Invesco Dynamic Large Cap Growth ETF (PWB) a Strong ETF Right Now?,19-Dec-22
"Twitter prohibits users from promoting accounts on Facebook, Mastodon",18-Dec-22
Twitter will remove accounts created solely to promote other social platforms,18-Dec-22
"1 Growth Stock That Could Soar 2,043% by 2026, According to Wall Street",18-Dec-22
3 Top Stocks to Buy if There Is a Market Pullback,18-Dec-22
5 No-Brainer Stocks to Buy Before 2023,18-Dec-22
Will Tesla Ever Be a Trillion-Dollar Stock Again?,17-Dec-22
The Latest News in the EV Sector,17-Dec-22
"EXCLUSIVE-PepsiCo to roll out 100 Tesla Semis in 2023, exec says",16-Dec-22
Elon Musk's Twitter suspension of journalists draws global backlash,16-Dec-22
Where Will Rivian Be in 5 Years?,16-Dec-22
EXCLUSIVE-PepsiCo to roll out 100 Tesla Semis in 2023 -exec,16-Dec-22
This Growth Stock's Jaw-Dropping Run-Up Is Smashing Tesla's,16-Dec-22
"After Hours Most Active for Dec 16, 2022 :  AMZN, CSCO, CMCSA, SWN, BAC, VZ, AAPL, TSLA, FBIN, KO, META, XOM",16-Dec-22
"Tesla Shares Down -55% This Year: Buy, Sell or Hold?",16-Dec-22
VettaFi Voices On: The Best New ETFs of 2022,16-Dec-22
VettaFi Voices On: The Best New ETFs of 2022,16-Dec-22
"Pre-Market Most Active for Dec 16, 2022 :  TQQQ, SQQQ, NVAX, MAXR, QQQ, TSLA, SUZ, AAPL, CS, NIO, GOTU, XPEV",16-Dec-22
"No, Tesla Stock Is Not Cheap",16-Dec-22
Tesla (TSLA) Gains As Market Dips: What You Should Know,15-Dec-22
Italian brake maker Brembo plans expansion in northern Mexico,15-Dec-22
"Ford hikes price of cheapest F-150 electric truck variant to nearly $56,000",15-Dec-22
Why Tesla’s Business (NASDAQ: TSLA) Won’t be Slowing Down Anytime Soon,15-Dec-22
Cathie Wood Goes Bargain Hunting: 3 Stocks She Just Bought,15-Dec-22
Best Stocks To Buy For 2023? 3 EV Stocks To Watch,15-Dec-22
"Notable ETF Inflow Detected - QQQ, NVDA, GOOG, TSLA",15-Dec-22
Buyer Beware: Elon Musk Sells $3.6 Billion of Tesla Shares,15-Dec-22
"S&P 500 Movers: WDC, CRL",15-Dec-22
Tesla Could Make a Major Announcement in 2023!,15-Dec-22
The Worst Investment Decision I Ever Made (And What I Learned From It),15-Dec-22
US STOCKS-Wall Street set to open sharply lower on angst over hawkish Fed,15-Dec-22
Better Buy: Tesla or General Motors?,15-Dec-22
"Consumer Sector Update for 12/15/2022: XLP, XLY, JEWL, TSLA, WBD",15-Dec-22
A Bull Market Is Coming in 2023: 3 No-Brainer Growth Stocks to Buy Right Now,15-Dec-22
"Pre-Market Most Active for Dec 15, 2022 :  TQQQ, SQQQ, TSLA, DASH, MDLZ, META, QQQ, NIO, BBVA, XPEV, CCL, CS",15-Dec-22
US STOCKS-Futures slide as hawkish Fed quashes policy pivot hopes,15-Dec-22
US STOCKS-Futures slide on worries over hawkish Fed,15-Dec-22
2023 Is Almost Here. Should You Keep Investing Right Now?,15-Dec-22
Elon Musk Sells $3.6 Bln Worth Tesla Shares,15-Dec-22
"Down 52% in 2022, Is Tesla Now a Buy?",15-Dec-22
Adding EVs to U.S. biofuels law is environmental agency's 2023 task,15-Dec-22
"MORNING BID-Thank you, next",15-Dec-22
Elon Musk sells Tesla shares worth $3.58 bln - filing,14-Dec-22
What's Going On With Tesla Shares?,14-Dec-22
Add a New Bull Market to Your Christmas List,14-Dec-22
US STOCKS-Wall Street ends lower after latest Fed rate hike,14-Dec-22
US STOCKS-Wall Street ends lower after latest Fed rate hike,14-Dec-22
Twitter suspends bot account tracking Elon Musk's jet,14-Dec-22
"Elon Musk No Longer World's Richest Person, Surpassed By Bernard Arnault",14-Dec-22
Tesla shares fall as investors bash Musk's Twitter focus,14-Dec-22
Tesla to search for water in quest to expand German gigafactory,14-Dec-22
US STOCKS-Wall Street ticks higher ahead of Fed rate decision,14-Dec-22
3 EV Stocks Worth Buying Before They Accelerate in 2023,14-Dec-22
US STOCKS-Wall St eyes muted open ahead of Fed decision,14-Dec-22
Is Now the Right Time to Buy Electric Vehicle Stocks?,14-Dec-22
"Pre-Market Most Active for Dec 14, 2022 :  IQ, TQQQ, TSLA, SQQQ, PBR, DIS, PFE, SOFI, GM, META, DAL, XPEV",14-Dec-22
US STOCKS-Futures flat ahead of Fed's rate decision,14-Dec-22
"EXCLUSIVE-Musk's banks to book Twitter loan losses, avoid big hits -sources",14-Dec-22
"The Zacks Analyst Blog Highlights Tesla, General Motors, Ford and BorgWarner",14-Dec-22
"Down 50% This Year, Is Tesla Stock A Buy?",13-Dec-22
"EXCLUSIVE-Musk's banks to book Twitter loan losses, avoid big hits -sources",13-Dec-22
Very Rare: 2 Leaders Near Long Term Buy Zone,13-Dec-22
"Tuesday Sector Laggards: Consumer Products, Utilities",13-Dec-22
US STOCKS-Wall St set to surge at open as CPI data calms rate hike jitters,13-Dec-22
The 4 Best Stocks to Capitalize on the Growing Shift to EVs,13-Dec-22
"US STOCKS-Futures rise ahead of CPI report, Fed rate decision",13-Dec-22
2 Major Catalysts for Tesla Stock Next Year,13-Dec-22
Tesla Most Fuel Efficient In 2021; Stellantis And GM Ranked Worst: EPA,13-Dec-22
FOCUS-German car giants and Asian battery kings: a match made in Hungary,13-Dec-22
FOCUS-German car giants and Asian battery kings: a match made in Hungary,13-Dec-22
"After Hours Most Active for Dec 12, 2022 :  IQ, AAPL, INTC, BAC, ALIT, MSFT, TSLA, SLGC, NIO, PM, ZTO, T",12-Dec-22
Why Tesla Stock Sold Off on Monday,12-Dec-22
Our Top 3 Social Media Stock Picks for 2023,12-Dec-22
PCAR vs. TSLA: Which Stock Is the Better Value Option?,12-Dec-22
The 3 Hottest EV Stocks to Own for 2023 and Beyond,12-Dec-22
"EV Roundup: LI Incurs Q3 Loss, WKHS Dims 2022 Forecast & More",12-Dec-22
"Tesla, Inc. (TSLA) Is a Trending Stock: Facts to Know Before Betting on It",12-Dec-22
"Pre-Market Most Active for Dec 12, 2022 :  HZNP, AMAM, TQQQ, SQQQ, COUP, CSX, GM, UBER, TSLA, NIO, XPEV, CVNA",12-Dec-22
"EXCLUSIVE-Zeekr, a premium Geely electric car brand, seeks over $1 billion in U.S. IPO - sources",12-Dec-22
EXCLUSIVE-Geely's premium electric car brand Zeekr seeks over $1 billion in U.S IPO - sources,12-Dec-22
EXCLUSIVE-Toyota to outline 3-year EV plan changes to suppliers -sources,11-Dec-22
"Nio Stock: Buy, Sell, or Hold in 2023?",11-Dec-22
"Fintel's 10 Biggest Short Positions for December, Revealed Here",10-Dec-22
2 Stocks Down 19% to 51% to Buy Right Now,10-Dec-22
Learning From Successful Investors,10-Dec-22
"5 Investment Opportunities With Over 700% Upside, According to Cathie Wood",10-Dec-22
Elton John quits Twitter,9-Dec-22
Recession drumbeat gets louder as more U.S. CEOs strike mellow note for 2023,9-Dec-22
Why Tesla Stock Revved Higher on Friday,9-Dec-22
Why Tesla Stock Was Falling This Week,9-Dec-22
US STOCKS-Wall St slips as inflation data ignites rate hike worries,9-Dec-22
Do Options Traders Know Something About Tesla (TSLA) Stock We Don't?,9-Dec-22
Our 7 Top Nasdaq Stock Picks for 2023,9-Dec-22
"Pre-Market Most Active for Dec 9, 2022 :  TQQQ, SQQQ, FORG, TSLA, NIO, XPEV, UBER, NSTC, SMMT, QQQ, BILI, CS",9-Dec-22
Why Nio Stock Jumped 32% in November,9-Dec-22
SpaceX Launches 40 OneWeb Satellites,9-Dec-22
Tesla to suspend Model Y output in Shanghai in last week of Dec-memo,9-Dec-22
South Korean shares post biggest weekly loss in over two months,9-Dec-22
Musk says wise to avoid margin loans during macroeconomic risks,9-Dec-22
Tesla (TSLA) Stock Sinks As Market Gains: What You Should Know,8-Dec-22
"Thursday Sector Laggards: Energy, Consumer Products",8-Dec-22
US STOCKS-Wall St set to open higher after recent slump,8-Dec-22
Our 7 Top Battery Stock Picks for 2023,8-Dec-22
2 Top Index Funds Growth Stock Investors Can Buy With Confidence Before 2023,8-Dec-22
"Pre-Market Most Active for Dec 8, 2022 :  PHVS, TQQQ, SQQQ, TSLA, BILI, NIO, SMMT, XPEV, CVNA, RLX, BEKE, CS",8-Dec-22
"US STOCKS-Futures edge up ahead of jobs data, recession fears loom",8-Dec-22
"Tesla to shorten Shanghai shifts, delay hiring - Bloomberg News",8-Dec-22
"China sold 1.67 mln passenger cars in Nov, down 9.5% y/y - CPCA",8-Dec-22
Musk taps Tesla's China chief to run Texas gigafactory - Bloomberg News,8-Dec-22
Musk taps Tesla's China chief to run Texas gigafactory- Bloomberg News,8-Dec-22
Musk's bankers mull new Tesla margin loans to slash Twitter debt - Bloomberg News,7-Dec-22
Musk's bankers mulling giving him new margin loans backed by Tesla stock- Bloomberg reporter tweet,7-Dec-22
Our 3 Top EV Stock Picks for 2023,7-Dec-22
Elon Musk loses title of world's richest man to LVMH's Arnault - Forbes,7-Dec-22
Invesco QQQ Experiences Big Outflow,7-Dec-22
"US STOCKS-Wall St extends losses as recession worries mount, Apple drops",7-Dec-22
My Top 3 Stocks to Buy for 2023,7-Dec-22
US STOCKS-Wall Street set to open lower as recession worries mount,7-Dec-22
Ukraine's Zelenskiy named Time's 2022 'Person of the Year',7-Dec-22
US STOCKS-Futures fall on growing fears of recession,7-Dec-22
Tesla launches EVs in Thailand amid competition from cheaper brands,7-Dec-22
